processo_numero,solicitacao_data,solicitacao_hora,solicitacao_descricao,solicitacao_bairro,solicitacao_localidade,solicitacao_endereco,processo_ocorrencia,is_confirmed,latitude,longitude,location_strategy,ground_type
8092231221,2021-10-15,09:31,USUÁRIO INFORMA QUE TERRENO JÁ INDENIZADO PELO AUXILIO MORADIA E CONDENADO PELA DEFESA CIVIL ESTA SENDO INVADIDO PARA MORADIA.,COHAB,VILA DO MILAGRES,"RUA AV PERNAMBUCO, N558",Invasao de Terreno de Auxilio Moradia,-1,-8.1187809,-34.9463292,google maps api,LVd2
8037908421,2021-04-29,11:35,SOLICITA VISTORIA EM ÁRVORE NO TERRENO DO VIZINHO QUE SEGUNDO SOLICITANTE AMEAÇA CAIR.,COHAB,VILA DO MILAGRES,"RUA DR PAULO DE BIASE, SN",Arvores em Risco,-1,-8.1219301,-34.9487028,google maps api,LVd2
8054667320,2020-07-28,16:15,usuário solicita erradicação da árvore,COHAB,VILA DO MILAGRES,RUA SAO MATEUS    n 308,Arvores em Risco,-1,-8.1115554,-34.9490443,google maps api,LVd2
8024738020,2020-02-20,14:16,USUÁRIO SOLICITA REPOSIÇÃO DE LONAS COM URGÊNCIA E VISTORIA  DE UM PÉ DE CÔCO NO QUINTAL.,COHAB,VILA DO MILAGRES,"2TR SERRA DA MANTIQUEIRA, N 329 A",Arvores em Risco,-1,-8.1116826,-34.9587716,google maps api,PV1
8028409020,2020-03-04,09:41,"USUÁRIO SOLICITA VISTORIA PARA ARVORE QUE OFERECE RISCO EM SUA CASA, INFORMA QUE ESTÁ INCLINADA.",COHAB,VILA DO MILAGRES,RUA SERRA CAIADA N 246,Arvores em Risco,-1,-8.1192344,-34.9487743,google maps api,LVd2
8052611918,2018-04-23,16:22,"USUÁRIO INFORMA QUE TEM UM COQUEIRO EM CIMA DO MURO DE ARRIMO , AMEAÇANDO CAIRE ATINGIR AS RESIDENCIAS.",COHAB,VILA DO MILAGRES,"RUA 2  TRAVESSA DR MOACIR SALES , N 48",Arvores em Risco,-1,-8.1227356,-34.9504903,google maps api,LVd2
8059623417,2017-07-04,13:41,INFORMA QUE A CASA FOI INTERDITADA POIS ESTA COM ALTO NIVEL DE DESLIZABENDO E TEVE UMA BARREIA QUE DESABOU EM CIMA DE 3 CASAS VIZINHAS  A DEFESA CIVIL FOI E ENTERDITOU A CASA NO DIA 30 06 17 E A MORADORA ESTA ENTRANDO EM CONTADO POIS PRECISA DO PROTOCOLO PARA DA ENTRADA NO AUSILHO MORADIA,COHAB,VILA DO MILAGRES,COHAB,Arvores em Risco,-1,-8.1185301,-34.9547489,google maps api,LVd2
8011432014,2014-07-17,12:07,"USUÁRIA SOLICITA CORTE DE DUAS ARVORES (CAJU, JACA), DEVIDO ESTA INCLINADA PARA CIMA DAS CASAS.",COHAB,VILA DO MILAGRES,"RUA VILA DO MILAGRES, N°95 / UR 3 IBURA",Arvores em Risco,-1,-8.112590599999999,-34.9497062,google maps api,LVd2
8080921722,2022-07-18,16:54,"SOLICITA VISTORIA EM SUA CASA ATINGIDA PELA ENCHENTE  SUBIU CERCA DE 1,80 A MESMA PERDEU PRATICAMENTE TUDO. A CASA ESTÁ COM VARIAS RACHADURAS ESPALHADAS PELA ESTRUTURA.",COQUEIRAL,COQUEIRAL,RUA CORIPÓS 45,Imoveis Alagados,-1,-8.0886604,-34.96868380000001,google maps api,PV1
8069259022,2022-06-17,13:29,SOLICITA VISTORIA EM SUA RESIDÊNCIA INUNDADA DEVIDO AS ULTIMAS CHUVAS. E DERRUBOU O MURO AO LADO DE SUA CASA.,COQUEIRAL,COQUEIRAL,RUA GUANABARA 350 CASA 4,Imoveis Alagados,-1,-8.0878093,-34.9652828,google maps api,PV1
8066458122,2022-06-11,14:53,VISTORIA EM CASA QUE FOI INUNDADA DEVIDO AS ULTIMAS ENCHENTES. 1 METRO E MEIO DE ÁGUA USUÁRIO PERDEU TUDO.,COQUEIRAL,COQUEIRAL,RUA IPATINGA 100,Imoveis Alagados,-1,-8.0866466,-34.97300329999999,google maps api,PV1
8038383815,2015-12-16,00:09,"USUÁRIO SOLICITA A VISTORIA NUMA LOJA DE ESTOFADOS. O MESMO DIZ QUE OS BOMBEIROS JÁ ESTÃO NO LOCAL, MAS PRECISA DA DEFESA CIVIL PARA FAZER O ISOLAMENTO DA ÁREA.",CAXANGA,CAXANGA,"2 TRAVESSA RIBEIRO PESSOA, SN",Incendios,-1,-8.0299624,-34.9579823,google maps api,A2
8010353516,2016-03-11,15:58,USUÁRIO INFORMA QUE TEM PESSOAS INVADINDO TERRENO DE PROPRIEDADE DA PREFEITURA,VASCO DA GAMA,ALTO DO EUCALIPTO,"ALTO DO EUCALIPTO SN, 00",Invasao de Terreno de Auxilio Moradia,-1,-8.0075558,-34.9199872,google maps api,A2
8008739716,2016-03-03,10:58,USUARIO INF QUE ESTAO INVADINDO O TERRENO,VASCO DA GAMA,ALTO DO EUCALIPTO,"RUA PIRIZAL, PROX AO 118",Invasao de Terreno de Auxilio Moradia,-1,-8.0075558,-34.9199872,google maps api,A2
8079271222,2022-07-13,11:50,"USUARIO INFORMA QUE TEM UMA ARVORE QUE DESLIZOU E CAIU NO QUITAL DO VIZINHO, PRECISA DA EQUIPE PARA VERIFICAR ESSA SITUAÇAO.",CGO. DO JENIPAPO,CGO. DO JENIPAPO,RUA CORREGO DO FERNANDINHO  N 315,Arvores em Risco,-1,-8.003007499999999,-34.9353713,google maps api,LVd4
8006414515,2015-03-06,09:14,"USUARIA INFORMA QUE RIO ESTA MUITO CHEIO COM RISCO DE TRANSBORDAMENTO, SEGUNDO ELA ALGUMAS BARRACOS JÁ ESTÃO ALAGADOS.",CAXANGA,CAXANGA,RUA DOUTOR GUSTAN DE CARVALHO SOARES,Elevacao do Nivel do Rio,-1,-8.026284,-34.9574901,google maps api,A2
8011530015,2015-04-20,00:40,"USUÁRIO INFORMA OCORREU UM INCÊNDIO EM UMA RESIDÊNCIA QUE ACABOU SE ALASTRANDO EM OUTRA DE 2 ANDARES, O MESMO TAMBÉM INFORMA QUE AS PAREDES ESTÃO COM RACHADURAS. PROTOCOLO DO BOMBEIRO: B951358. CABO ANDRADE DO BOMBEIRO DA EMERGÊNCIA DO CIODES QUE ENTROU EM CONTATO.",CAXANGA,CAXANGA,"PROFESSOR ANTONIO LUIZ LINS DE BARROS, S/Nº",Incendios,-1,-8.0252612,-34.9581634,google maps api,A2
8059331121,2021-07-06,13:34,USUÁRIO INFORMA QUE MURO DE ARRIMO ESTA COM RACHADURAS DEIVIDO E UMA ARVORE TER NASCIDO NO MEIO DO MURO.,CGO. DO JENIPAPO,CGO. DO JENIPAPO,TRV SAO SEBASTIAO N 42,Arvores em Risco,-1,-8.0071968,-34.9343408,google maps api,LVd4
8067845919,2019-06-01,14:23,USUÁRIO INFORMA QUE ESTÃO INVADINDO UM LOCAL QUE JÁ INTERDITADO PELA DEFESA CIVIL.,CGO. DO JENIPAPO,CGO. DO JENIPAPO,RUA CÓRREGO JOSÉ APRÍGIO,Invasao de Terreno de Auxilio Moradia,-1,-7.9990679,-34.9382999,google maps api,LVd4
8051690218,2018-04-21,10:39,"A USUÁRIA INFORMA QUE ELA TEM O BENENFECIO DO AUXILIO MORADIA, A SUA CASA FOI  INTERDITADA , E MESMA INFORMA QUE ESTÃO INVADINDO A SUA RESIDENCIA",CGO. DO JENIPAPO,CGO. DO JENIPAPO,RUA TRES MORROS,Invasao de Terreno de Auxilio Moradia,-1,-8.0023858,-34.9369028,google maps api,LVd4
8032707416,2016-06-06,09:03,"USUARIA RELATA QUE FOI INVADIDO O TERRENO AO LADO DA SUA CASA E TEM ARVORES QUE ESTAO EXPOSTAS, A MESMA PEDE VISTORIA.",CGO. DO JENIPAPO,CGO. DO JENIPAPO,"RUA DA DEMOCRACIA,68",Arvores em Risco,-1,-8.0068189,-34.9371083,google maps api,LVd4
8063531022,2022-06-07,13:06,USUÁRIO SOLICITA VISTORIA EM SUA RESIDENCIA TRATA/SE DE UM(A): NORMAL. FOI INUNDADA DEVIDO AS ENCHENTES DA ULTIMAS SEMANAS TEM CERCA DE 1 ANO DE CONSTRUIDO.,CIDADE UNIVERSITARIA,CIDADE UNIVERSITARIA,AV PROFESSOR LUIS FREIRE 1164,Imoveis Alagados,-1,-8.0563221,-34.9561199,google maps api,A2
8002496715,2015-01-29,11:45,A USUÁRIA INFORMA QUE UM SENHOR ESTÁ VENDENDO LOTEAMENTOS CONDENADOS PELA CODECIR. SOLICITA VISTORIA.,CGO. DO JENIPAPO,CGO. DO JENIPAPO,R. VENEZA ( LOT. PARQUE DOIS IRMÃOS,Invasao de Terreno de Auxilio Moradia,-1,-7.9980779,-34.9388449,google maps api,LVd4
8039596120,2020-04-25,10:38,"USUÁRIA SOLICITA VISTORIA, POIS INFORMA QUE TEM UM PAU BRASIL DENTRO DO CONDOMÍNIO RIO GUAIBA QUE ESTÁ OFERECENDO RISCO DE QUEDA EM CIMA DAS CASAS VIZINHAS. INFORMA QUE CAIU UM GALHO ONTEM EM CIMA DO CARRO DA OFICINA AO LADO.",CIDADE UNIVERSITARIA,CIDADE UNIVERSITARIA,"RUA DEPUTADO CUNHA RABELO, 201",Arvores em Risco,-1,-8.0457251,-34.9484014,google maps api,A2
8062652021,2021-07-17,17:22,SRA SOLICITA VISTORIA EM UM PÉ DE COQUEIRO,CIDADE UNIVERSITARIA,CIDADE UNIVERSITARIA,AV BARAO DE BONITO N811,Arvores em Risco,-1,-8.0390657,-34.9515557,google maps api,A2
8014622522,2022-02-14,18:40,"SEGUNDO O SARGENTO HOUVE O INCÊNDIO, EM UM LOCAL QUE TEM VÁRIAS RESIDÊNCIAS OS MORADORES SOLICITAM A EQUIPE DA DEFESA CIVIL PARA UMA AVALIAÇÃO MAIS TÉCNICA.",COELHOS,COELHOS,RUA DOS COELHOS 466,Incendios,-1,-8.067807,-34.8905753,google maps api,ILHA
8049927017,2017-06-06,10:21,USUÁRIA SOLICITA UMA VISTORIA NA RESIDENCIA POIS A ARVORE CAIU E SOLICITA URGENCIA,CAXANGA,CAXANGA,"RUA SAÃO FANCISCO DE PAULA, 103",Arvores em Risco,-1,-8.030264899999999,-34.9555592,google maps api,A2
8066469717,2017-07-21,19:29,"USUÁRIA INFORMA QUE TEM 2 TERRENOS AO REDOR DE SUA RESIDÊNCIA QUE ESTÃO BASTANTE ALAGADOS E CAUSANDO TRANSTORNOS A SUA RESIDÊNCIA, A MESMA DIZ QUE AS PAREDES ESTÃO BASTANTE ENCHARCADAS. PEDE UMA VISTORIA COM URGÊNCIA NO ATENDIMENTO.",CAXANGA,CAXANGA,Rua Tabelião João Roma.,Imoveis Alagados,-1,-8.0263583,-34.9500162,google maps api,A2
8004501616,2016-02-04,07:37,"ARVORE (PÉ DE MACAIBA) COM RISCO DE QUEDA ONDE DANIFICARÁ IMOVEL DO DEMANDANTE, PEDE AVALIAÇÃO COM URGENCIA",VASCO DA GAMA,VASCO DA GAMA,RUA SANTA CLARA 220,Arvores em Risco,-1,-8.0140195,-34.9210203,google maps api,A2
8008704916,2016-03-03,10:20,usuario relata que esta sendo invadido o local que ja foi condenado pela codecir,VASCO DA GAMA,JD. VASCO DA GAMA,rua atapus,Invasao de Terreno de Auxilio Moradia,-1,-8.0130226,-34.9225129,google maps api,A2
8017668116,2016-04-16,13:06,"USUÁRIA SOLICITA UMA VISTORIA EM SUA CASA, POIS A MESMA ESTA ALAGADA. URGENTE. A MESMA NÃO PODE FICAR NO LOCAL.",CAXANGA,CAXANGA,"RUA DR ROMERO MARQUES, N 16.",Imoveis Alagados,-1,-8.0274091,-34.9542623,google maps api,A2
8017737316,2016-04-16,15:58,"USUÁRIA SOLICITA UMA EQUIPE NO LOCAL, POIS MAIS DE 114 FAMILIAS ESTÃO DESALOJADAS DEVIDO AOS ALAGAMENTOS.",CAXANGA,CAXANGA,RUA DR DUSTÃ DE CARVALHO SOARES.,Imoveis Alagados,-1,-8.026284,-34.9574901,google maps api,A2
8017534516,2016-04-16,10:29,"usuario informa que a rua toda esta alagada, rio transbordo e pessoas sem poder sair da residencia",CAXANGA,CAXANGA,Rua Professor Antônio Luiz Lins de Barros,Imoveis Alagados,-1,-8.0252612,-34.9581634,google maps api,A2
8017934316,2016-04-17,08:15,SR MARIA INFORMA QUE O RIO TRANSBORDOU E OS MORADORES ESTÃO COM AS CASAS CHEIAS DE AGUA.,CAXANGA,CAXANGA,"Rua Doutor Dustan de Carvalho Soares, 87",Alagamentos,-1,-8.0265363,-34.9574828,google maps api,A2
8030305616,2016-05-30,08:07,USUARIA SOLICITA UMA VISTORIA EM SUA RESIDENCIA POIS A MESMA ESTA ALAGADA E SOLICITA URGENCIA,CAXANGA,CAXANGA,"RUA JOAQUIM JENUINO AMANCIO, 66",Imoveis Alagados,-1,-8.0234275,-34.967197,google maps api,LVd2
8030408016,2016-05-30,10:54,USUARIA SOLICITA UMA VISTORIA NA RUA POIS VARIAS RESIDENCIAS ESTÃO ALAGADAS E MORADORES NÃO TEM PARA  ONDE IR E SOLICITA URGENCIA,CAXANGA,CAXANGA,"RUA DR DUSTAN DE CARVALHO SOARES, SN",Imoveis Alagados,-1,-8.026284,-34.9574901,google maps api,A2
8054741016,2016-09-01,12:58,"usuario informa que houve um incêndio no prédio, solicita de urgência da vistoria no local",CAXANGA,CAXANGA,RUA DEPUTADO  JOSE FRANCISCO DE MELO CAVALCANTI n 460,Incendios,-1,-8.0258691,-34.9507843,google maps api,A2
8018360215,2015-06-29,03:34,USUÁRIO SOLICITA UMA EQUIPE NO LOCAL DEVIDO A GRANDE VOLUME DE ÁGUA. A MESMA DESEJA UMA ASSISTÊNCIA.,CAXANGA,CAXANGA,"RUA PROFESSOR ANTONIO LUIZ LINS DE BARROS, Nº83",Alagamentos,-1,-8.0236893,-34.9575704,google maps api,A2
8018366015,2015-06-29,04:19,"SR NADIA INFORMA QUE ESTA ILHADA E QUE TEM MAIS 1MT DE AGUA, SEM DANOS A ESTRUTURA DA CASA E MESMA ESTA COM MEDO DE FICAR ILHADA.",CAXANGA,CAXANGA,"AV JOAQUIM RIBEIRO, N 740",Alagamentos,-1,-8.025341899999999,-34.9610636,google maps api,A2
8018382615,2015-06-29,05:10,USUÁRIA SOLICITA UMA EQUIPE NO LOCAL DEVIDO AO TRANSBORDAMENTO DO CANAL. A MESMA INFORMA QUE TODAS AS CASAS DA RUA FORAM ATINGIDAS.,CAXANGA,CAXANGA,"RUA DOUTOR DUSTAN DE CARVALHO SOARES, Nº 87",Imoveis Alagados,-1,-8.0265363,-34.9574828,google maps api,A2
8022909515,2015-07-27,02:16,"USUÁRIA SOLICITA A VISTORIA NO LOCAL, POIS NO LOCAL ESTÁ ALAGADO.",CAXANGA,CAXANGA,"RUA DR ROMERO MARQUES, N 16",Alagamentos,-1,-8.0274091,-34.9542623,google maps api,A2
8069154322,2022-06-17,11:00,"USUARIO INFORMA ALAGAMENTO, CASA COM RACHADURAS, SOLICITA VISTORIA.",CAXANGA,CAXANGA,"RUA ALMIRANTE JOAO PASCOELE , 69",Alagamentos,-1,-8.0290266,-34.9512051,google maps api,A2
8064424222,2022-06-08,12:24,USUÁRIO SOLICITA VISTORIA EM RESIDÊNCIA. ATINGIDA POR ALAGAMENTOS DEVIDO AS FORTES CHUVAS. CASA NORMAL TIPO TERREO.,CAXANGA,CAXANGA,RUA DEPUTADO JOSE FRANCISCO DE MELO CAVALCANTE 633,Imoveis Alagados,-1,-8.024778399999999,-34.9470465,google maps api,A2
8076423622,2022-07-05,18:53,"USUÁRIA INFORMA QUE OUVE UM ALAGAMENTO QUE ATINGIU A SUA RESIDENCIA, E LOGO APÓS ISSO A RESIDENCIA APARECEU RACHADURAS!",CAXANGA,CAXANGA,RUA ALMIRANTE JOAO PASCOA N.50,Imoveis Alagados,-1,-8.0290283,-34.9513304,google maps api,A2
8056316121,2021-06-27,16:31,SR SOLICITA VISTORIA NUMA ARVORE QUE ESTA COM RISCO DE QUEDA DENTRO DO TERRENO,CAXANGA,CAXANGA,RUA JOAQUIM DE BRITO N54 A,Arvores em Risco,-1,-8.0620767,-34.8926503,google maps api,AGUA
8027459022,2022-03-22,07:47,"solicita vistoria no local, informa alagamento no local desde o dia anterior.",CAXANGA,CAXANGA,"RUA DOUTOR DUSTAN DE CARVALHO SOARES,97",Alagamentos,-1,-8.024715,-34.9569136,google maps api,A2
8052987722,2022-05-25,09:58,A MESMA INFORMA QUE A COMUNIDADE ESTA TODA ALAGADA,CAXANGA,CAXANGA,RUA PADRE HENRIQUE N.38,Alagamentos,-1,-8.046968800000002,-34.9620849,google maps api,A2
8129193019,2019-10-30,13:55,USUÁRIO SOLICITA ERRADICAÇÃO DE UMA ARVORE (MANGUEIRA) QUE ESTÁ DENTRO DO QUINTAL  OFERECENDO RISCO DE CAIR E ATINGIR AS RESIDENCIAS.,CAXANGA,CAXANGA,"RUA ENGENHO POETA , N 215",Arvores em Risco,-1,-8.0302399,-34.9512536,google maps api,A2
8031382021,2021-04-12,10:08,"USUÁRIA SOLICITA INFORMAÇÕES DE ABRIGO, INFORMA QUE SUA CASA FOI INVADIDA PELAS ÁGUAS DEVIDO A CHUVA E A MESMA PERDEU ALIMENTOS, COLCHÃO E MOVEIS.",CAXANGA,CAXANGA,RUA DOUTOR DUSTAN DE CARVALHO SOARES N 97,Alagamentos,-1,-8.024715,-34.9569136,google maps api,A2
8021636819,2019-02-21,09:39,"O MESMO INFORMA QUE FOI CONSTRUIDA UMA CASA NA PARTE DE CIMA DO MURO DE ARRINMO, O MESMO RESIDE NA PARTE DE BAIXO. SEGUNDO O MESMO A CASA D CIMA AMEAÇA CAIR ( BOM REPOUSO, N49) E DURANTE TODO O TEMPO CHUVOSO  ÁGUA DA CHUVA ESCORRE POR CIMA DE SUA CASA. ENTRAR EM CONTO COM SEVERINO (08131847525 )",CAXANGA,CAXANGA,"RUA BOM REPOUSO, N49",Arvores em Risco,-1,-8.0230192,-34.9638972,google maps api,LVd2
8074301019,2019-06-13,09:37,USUÁRIO INFORMA SOBRE ALAGAMENTO NAS CASAS DA RUA CITADA. MORADORES ESTÃO ILHADOS E NECESSITAM DO AUXILIO DA DEFESA CIVIL POIS AS CASAS FICAM MUITO PRÓXIMAS AOS RIOS,CAXANGA,CAXANGA,RUA DR DUSTAN DE CARVALHO SOARES,Alagamentos,-1,-8.026284,-34.9574901,google maps api,A2
8074777519,2019-06-13,14:10,USUÁRIA SOLICITA VISTORIA POIS O RIO TRANSBORDOU E A ÁGUA ENTROU DENTRO DAS CASAS,CAXANGA,CAXANGA,AVENIDA JOAQUIM RIBEIRO 740,Elevacao do Nivel do Rio,-1,-8.025341899999999,-34.9610636,google maps api,A2
8073554617,2017-08-12,09:13,"USUÁRIA INFORMA QUE O IMÓVEL CONTÉM  VÁRIAS RACHADURAS AO REDOR DO MESMO E CONTÉM VÁRIAS  INFILTRAÇÕES TAMBÉM. O MESMO ESTÁ COM UM BURACO NO TETO DA SALA DA CASA. USUÁRIA INFORMA QUE SEU IMÓVEL, PRINCIPALMENTE NA PARTE DA SALA, FICA ALAGADO NAS ÉPOCAS DE CHUVAS. FAVOR VERIFICAR COM URGÊNCIA",CAXANGA,CAXANGA,"RUA DOUTOR ROMERO MARQUES, 16",Imoveis Alagados,-1,-8.0274091,-34.9542623,google maps api,A2
8043605018,2018-04-07,09:55,DESEJA VISTORIA POIS SÃO 35 CASAS ALAGADAS,CAXANGA,CAXANGA,RUA DOUTOR  DUSTAN DE CARVALHO SOARES  87,Alagamentos,-1,-8.0265363,-34.9574828,google maps api,A2
8103151018,2018-08-20,06:54,DESEJA VISTORIA COQUEIRO COM RISCO DE QUEDA EM CIMA DE UMA CASA,CAXANGA,CAXANGA,Rua Genuíno Joaquim Amâncio 66,Arvores em Risco,-1,-8.0234275,-34.967197,google maps api,LVd2
8044854517,2017-05-25,13:29,"USUARIA INFORMO QUE RESIDE EM UMA AREA DE ALAGAMENTO E SUA RESIDENCIA ESTA APRESENTANDO MUITAS RACHADURAS, FAVOR VERIFICAR",CAXANGA,CAXANGA,RUA EUGENIO COIMBRA N 85,Alagamentos,-1,-8.023513099999999,-34.9548721,google maps api,A2
8047019017,2017-05-31,11:17,"USUÁRIA PEDE VISTORIA URGENCIA NA DEMANDA POIS 33 FAMÍLIAS ESTÃO DESABRIGADAS DEVIDO AO RIO TER TRANSBORDADO ,TODOS ESTÃO DESABRIGADOS NA RUA ,ESTÃO AGUARDANDO O APOIO.",CAXANGA,CAXANGA,RUA DR DUSTAN 601,Alagamentos,-1,-8.026031,-34.9527201,google maps api,A2
8006487016,2016-02-22,08:50,"usuaria relata que a sua mae marisa severina esta recebendo auxilio moradia a dez anos devido a uma desapropriaçao,agora estao construindo onde ela morava e a mesma deseja providencia.favor verificar.",VASCO DA GAMA,ALTO DO EUCALIPTO,RUA PARDAL,Invasao de Terreno de Auxilio Moradia,-1,-8.0075558,-34.9199872,google maps api,A2
8002415715,2015-01-28,17:19,"USUÁRIA INFORMA QUE A ÁRVORE ESTÁ CAUSANDO TRANSTORNOS NÃO SÓ A SUA RESIDÊNCIA, COMO TAMBÉM AO VIZINHO. ÁRVORE ESTÁ COM RAÍZES ENTRANDO DE MURO A DENTRO.",CASA AMARELA,CASA AMARELA,"AV NORTE, 5080",Arvores em Risco,-1,-8.0241613,-34.9110887,google maps api,URBANO
8005344315,2015-02-26,17:03,"MORADORA INFORMA QUE TEM 4 ARVORES NO MURO DE ARRIMO DE MEDIO E GRANDE PORTE QUE ESTÃO COM RISCO DE QUEDA, POIS ESTÃO SE INCLINANDO PARA PARTE DE BAIXO, ONDE FICA SUA RESIDENCIA. PEDE VISTORIA E A ERRADICAÇÃO DESSAS ARVORES COM URGENCIA.",CASA AMARELA,CASA AMARELA,"RUA PRIMEIRO DE JANEIRO, Nº 179",Arvores em Risco,-1,-8.028107499999999,-34.9213938,google maps api,AGUA
8016219214,2014-09-18,14:12,a usuaria informa que disjuntor que atende a energia de sua residencia esta irregular podendo causar serios riscos para o moradores do conjunto habitacional.favor verificar com urgencia.contt: 95424749,CASA AMARELA,CASA AMARELA,"av estrada do arraial,n°385",Incendios,-1,-8.026706,-34.916271,google maps api,A2
8019138314,2014-10-30,13:47,"USUÁRIA INFORMA QUE TEM UMA ARVORE (CAJUEIRO) QUE SE ENCONTRA NA RESIDENCIA DE Nº 187 QUE ESTÁ COM CUPIM E CAUSANDO DANOS AS RESIDENCIAS VIZINHAS NO CASO TELHADOS PAREDES E ETC, A MESMA SOLICITA/SE UMA VISTORIA NO LOCAL FAVOR VERIFICAR.",CASA AMARELA,CASA AMARELA,"Avenida Malacó, nº 187",Arvores em Risco,-1,-8.0251314,-34.923384,google maps api,A2
8039600920,2020-04-25,11:09,USUÁRIO INFORMA QUE TEM UMA ARVORE QUE ESTÁ CEDENDO EM CIMA DO SEU COMERCIO. AMEAÇA DESABAR A QUALQUER MOMENTO.,CASA FORTE,CASA FORTE,AVENIDA 17 DE AGOSTO N1270,Arvores em Risco,-1,-8.0366392,-34.9195994,google maps api,AGUA
8061757420,2020-08-28,13:39,ocorrência de incêndio no apartamento,CASA FORTE,CASA FORTE,Rua Lemos Torres  n 49,Incendios,-1,-8.0342784,-34.91575,google maps api,URBANO
8072031821,2021-08-12,14:42,USUÁRIO INFORMA QUE ARVORE NO QUINTAL JA CAIU VARIOS GALHOS E MORA AO LADO DE UM ABRIGO DE IDOSA ONDE JA CIU GALHOS E QUEBROU PARTE DO LOCAL.,CASA FORTE,CASA FORTE,RUA DONA RITA DE SOUZA N 122,Arvores em Risco,-1,-8.0327895,-34.9168809,google maps api,URBANO
8010344014,2014-07-02,16:51,TESTE,CASA AMARELA,CASA AMARELA,RESTE,Imoveis Alagados,-1,-8.0267917,-34.9177591,google maps api,A2
8011024914,2014-07-13,09:26,Teste de abertura do processo / Abimael por favor cancelar este processo.,CASA AMARELA,CASA AMARELA,"Estrada do Arraial, 3720, apto. 604",Alagamentos,-1,-8.0265781,-34.9153837,google maps api,A2
8061086217,2017-07-06,20:49,"USUÁRIO INFORMA QUE TEM UMA ÁRVORE QUE JÁ ESTÁ BASTANTE DETERIORADA POR DENTRO E ESTÁ ESCORADA EM OUTRA ÁRVORE, O MESMO DIZ QUE ESTÁ CAUSANDO RISCO DE QUEDA EMINENTE DAS DUAS. PEDE QUE UMA EQUIPE POSSA COMPARECER NO LOCAL PARA REALIZAR UMA VISTORIA EMERGENCIAL.",CASA FORTE,CASA FORTE,"RUA APIPUCOS, N 235",Arvores em Risco,-1,-8.0267527,-34.9305696,google maps api,A2
8017850018,2018-02-07,08:58,USUÁRIO INFORMA QUE HÁ UMA ARVORE RE CUJAS RAÍZES CRESCERAM DE MODO A DANIFICAR A ESTRUTURA DO PRÉDIO.USUÁRIO SOLICITA VISTORIA DA DEFESA CIVIL PARA QUE NÃO OCORRAM MAIORES ACIDENTES,CASA FORTE,CASA FORTE,"AV. 17 DE AGOSTO, 1112",Arvores em Risco,-1,-8.037646,-34.9185935,google maps api,AGUA
8022411914,2014-12-23,21:20,a usuaria informa que a tubulaçao de gás do predio esta vazando e pede a vistoria da equipe para verificar a situaçao.favor verificar com urgencia.contt: 8139/2603,CASA FORTE,CASA FORTE,rua silvino lopes,Produtos Quimicos Perigosos,-1,-8.0331271,-34.9174953,google maps api,URBANO
8012597916,2016-03-22,16:17,USUÁRIA SOLICITA VISTORIA EM ÁRVORE CORAÇÃO DE NEGRO QUE JÁ DANIFICOU UMA CAIXA D'ÁGUA E TEME POR TER COMPROMETIDO A ESTRUTURA DO PREDIO.,CASA FORTE,CASA FORTE,Rua Jayme Loyo   N 140,Arvores em Risco,-1,-8.0359894,-34.9151578,google maps api,URBANO
8052593922,2022-05-25,03:23,SOLICITANTE INFORMA QUE A RUA ESTA ALAGADA E OS MORADORES ESTAO PRESOS DENTRO DE SUAS RESIDENCIAS. O MESMO PEDE UMA EQUIPE COM URGENCIA NO LOCAL.,CAXANGA,CAXANGA,RUA PROFESSOR ANTONIO LUIZ LINS BARROS N 58,Alagamentos,-1,-8.0248989,-34.9581648,google maps api,A2
8024613021,2021-03-18,14:26,USUÁRIO INFORMA QUE PESSOAS DA MESMA FAMÍLIA IDENIZADOS PELO AUXILIO MORADIA. ESTÃO INVADINDO NOVAMENTE O TERRENO E EFETUANDO A CONTRUÇÃO DE NOVOS BARRACOS.,CASA AMARELA,CASA AMARELA,RUA MARIBONDO SN,Invasao de Terreno de Auxilio Moradia,-1,-8.0114639,-34.914992,google maps api,A2
8079259620,2020-11-11,09:51,SOLICITA VISTORIA EM PÉ DE COCO E PÉ DE DENDÊ  RISCO DE CAIR NA CASA,CASA AMARELA,CASA AMARELA,RUA GOIANDIRA 58,Arvores em Risco,-1,-8.024425299999999,-34.9254541,google maps api,A2
8081952720,2020-11-22,14:04,"visita técnica pós incêndio, local do incêndio 11 andar",CASA AMARELA,CASA AMARELA,Rua Guedes Pereira n 144,Incendios,-1,-8.029645799999999,-34.909007,google maps api,URBANO
8127266118,2018-10-16,13:43,USUÁRIA INFORMA QUE O APTO DELA TEVE UM PRECIPIO DE INCENDIO DO VAZAMENTO DE GAS E OUTRO DOIS APARTEMNTO TAMBEM TEVE E A MESMO INFORMA QUE SINDICO NAO QUER FECHER O REGISTRO DO GAS DOS APTOS.,CASA AMARELA,CASA AMARELA,RUA OSCAR PINTO N 293 APTO 1501,Incendios,-1,-8.0254871,-34.91207929999999,google maps api,URBANO
8063289618,2018-05-15,13:27,USUÁRIA INFORMA QUE A ÁRVORE É DE GRANDE PORTE E ESTÁ ARRISCANDO CAIR.,CASA AMARELA,CASA AMARELA,RUA MAL ME QUER,Arvores em Risco,-1,-8.0273486,-34.9209934,google maps api,A2
8059365517,2017-07-04,08:50,"USUARIO INFORMA QUE A ARVORE ESTA NO SEU QUINTAL, POREM MUITO VELHA E ESTA COM OS GALHOS ENROLADOS NA FIACAO ELETRICA DO POSTE , O MESMO FOI INFORMAO A ENTRAR EM CONTATO TAMBEM COM A CELPE.",CASA AMARELA,CASA AMARELA,1 TRAVESSA DO RESERVATORIO N 04,Arvores em Risco,-1,-8.0267917,-34.9177591,google maps api,A2
8097207417,2017-10-21,23:42,"o usuario informa que desabou o teto junto com laje da cozinha de sua  residencia,favor verificar com urgencia.",CASA AMARELA,CASA AMARELA,RUA   RODRIGUES SETE,Imoveis Alagados,-1,-8.0275317,-34.9079491,google maps api,URBANO
8058920517,2017-07-01,08:17,USUARIO INFORMA QUE A AGUA DA CHUVA ESTA ESCORRENDO E INVADINDO AS CASAS.,CASA AMARELA,CASA AMARELA,SEGUNDA TRAVESSA DA RUA JAPURA,Imoveis Alagados,-1,-8.0199946,-34.9093347,google maps api,URBANO
8048206817,2017-06-02,08:38,"deseja vistoria de arvore (coqueiro),risco de queda em cima do prédio da prefeitura .urgência !",CASA AMARELA,CASA AMARELA,av norte 5600,Arvores em Risco,-1,-8.024624,-34.910385,google maps api,URBANO
8003094816,2016-01-26,16:13,"USUÁRIA INFORMA QUE STÃO INVADINDO O SEU TERRENO, E QUE ESTÁ SENDO FEITA UMA CONSTRUÇÃO.",CASA AMARELA,CASA AMARELA,"RUA PARDAL N, 248",Invasao de Terreno de Auxilio Moradia,-1,-8.0110993,-34.9175002,google maps api,A2
8003621816,2016-01-29,16:56,ARVORE DE GRANDE PORTE COM RISCO DE QUEDA.,CASA AMARELA,CASA AMARELA,"RUA ASTRONAUTA ALDRIM, 81",Arvores em Risco,-1,-8.0258983,-34.9081972,google maps api,URBANO
8003834116,2016-01-30,11:42,USUARIO SOLICITA UMA VISTORIA TEM UMA ARVORE DE GRANDE PORTE APROXIMADAMENTE DE 10M QUE RACHOU E ESTA NA BEIRA DO CANAL E OFEREÇE RISCO DE QUEDA E SOLICITA URGENCIA,CASA AMARELA,CASA AMARELA,"AV. NORTE, 5786",Arvores em Risco,-1,-8.022273,-34.91536,google maps api,URBANO
8028180715,2015-09-09,11:39,"arvore está prestes a cair, o mesmo contato a emlurb nº 21452472 da O.S e ninguem se dirige ao local para efetuar vistoria ou erradicar, o mesmo informa que está apresentando risco.",CASA AMARELA,CASA AMARELA,"RUA   EVARISTO DA VEIGA, N",Arvores em Risco,-1,-8.0286028,-34.9149809,google maps api,A2
8018337015,2015-06-29,00:52,"USUÁRIA INFORMA QUE A SUA RESIDÊNCIA ESTÁ ALAGADAS DEVIDO AO CANAL DO BANORTE TER TRANSBORDADO. A MESMA INFORMA QUE A RESIDÊNCIA ESTÁ COM RACHADURAS, E DIZ TAMBÉM QUE, COM ESSES TRANSTORNOS A CASA ESTÁ APARENTANDO COM A ESTRUTURA BASTANTE AFETADA.",CASA AMARELA,CASA AMARELA,"1ª TRAVESSA DA RUA ARNOLDO MAGALHÂES, Nº 248",Alagamentos,-1,-8.0286033,-34.910005,google maps api,URBANO
8105619719,2019-08-29,13:55,"USUÁRIA SOLICITA VISTORIA DE ARVORE NA RESIDENCIA COM URGÊNCIA, INFORMA QUE ESTÁ COM ALTO RISCO E JÁ CAIU UM GALHO DE GRANDE PORTE.",CAMPO GRANDE,CAMPO GRANDE,"RUA ALMIRANTE BARROSO, N 210",Arvores em Risco,-1,-8.0297591,-34.8851954,google maps api,LVd4
8086548818,2018-07-09,21:50,"USUÁRIA INFORMA QUE TEM UMA MANGUEIRA EM RISCO EMINENTE DE QUEDA, O MESMO INFORMA QUE JÁ CAÍRAM VÁRIAS GALHAS QUE QUEBRARAM O MURO E DANIFICARAM A FIAÇÃO ELÉTRICA. FAVOR VERIFICAR COM URGÊNCIA.",CAMPO GRANDE,CAMPO GRANDE,"RUA LEDINHA, S N",Arvores em Risco,-1,-8.0391539,-34.8806238,google maps api,URBANO
8111974118,2018-09-06,07:12,Corpo de bombeiros foi acionado para controlar um incêndio.  Tenente do corpo de bombeiros informa que o incêndio já foi controlado mas a estrutura do bar e o teto estão avariados. favor verificar.Obs: Nome do responsável que acionou o corpo de bombeiros é o senhor Carlos Alberto,CAMPO GRANDE,CAMPO GRANDE,"Estrada de Belém, n 1294",Incendios,-1,-8.032491499999999,-34.8805114,google maps api,URBANO
8061781217,2017-07-10,08:00,"USUÁRIA INFORMA QUE A ARVORE , QUE FICA NO TERRENO DO SEU VIZINHO,  ESTÁ TRAZENDO RISCOS, POIS ESTÁ PENDENDO PARA O LADO DA SUA CASA, COMPROMETENDO A REDE DE FIOS DE ALTA TENSÃO. FAVOR VERIFICAR",CAMPO GRANDE,CAMPO GRANDE,RUA MARQUES DE ABRANTES,Arvores em Risco,-1,-8.0304981,-34.8806041,google maps api,URBANO
8076237117,2017-08-22,08:49,USUÁRIO SOLICITA VISTORIA EM UMA ÁRVORE QUE OFERECE GRANDE RISCO A RESIDÊNCIA.,CAMPO GRANDE,CAMPO GRANDE,"RUA LEDINHA, 39",Arvores em Risco,-1,-8.0396609,-34.8807986,google maps api,URBANO
8076242517,2017-08-22,08:53,SOLICITA VISTORIA EM ÁRVORE QUE ESTÁ POR TRÁS DE UMA CRECHE ABANDONADA.CRECHE ESTÁ SENDO UTILIZADA COMO MORADIA,CAMPO GRANDE,CAMPO GRANDE,RUA B,Arvores em Risco,-1,-8.032163500000001,-34.881336,google maps api,URBANO
