processo_numero,solicitacao_data,solicitacao_hora,solicitacao_descricao,solicitacao_bairro,solicitacao_localidade,solicitacao_endereco,processo_ocorrencia,is_confirmed,latitude,longitude,location_strategy,ground_type
8028153816,2016-05-23,09:10,USUARIA SOLICITA UMA VISTORIA EM TRES ARVORES DE GRANDE PORTE ENTRE ESSAS ARVORES POSSUI UMA JAQUEIRA QUE OS FRUTOS ESTÃO CAINDO NA CASA DA VIZINHA E OFEREÇE RISCO DE QUEDA EM CIMA DA CASADE SUA VIZINHA E TEM CRIANÇA DE MENORES NA RESIDENCIA E SOLICITA URGENCIA,IBURA,UR 02,"RUA SAO FRANCISCO, 15",Arvores em Risco,-1,-8.0625047,-34.8980414,google maps api,URBANO
8030590216,2016-05-30,13:57,DESEJA VISITA  EM SUA CASA ESTA ALAGADA E NAO TEM PRA ONDE IR INFORMA QUE ESTA NA LINHA DO TREM .ORIENTADA IR A UM LOCAL SEGURO,IBURA,IBURA DE BAIXO,RUA PONTE PRETA 22,Alagamentos,-1,-8.114773699999999,-34.9399567,google maps api,LVd2
8030471316,2016-05-30,12:11,"USUÁRI  SOLICITA VISTORIA E ERRADICAÇÃO DE ARVORE, INFORMA QUE ARVORE ESTA COM RISCO DE QUEDA EM CIDA DAS RESIDENCIA QUE TEM VARIAS CRIANAÇAS PEDE URGÊNCIA.",IBURA,UR 10,"RUA CONTINETAL N, 505",Arvores em Risco,-1,-8.135449399999999,-34.9479057,google maps api,LVd2
8029054316,2016-05-25,09:31,USUARIO DESEJA VISTORIA EM UMA ARVORE QUE ESTA COM RISCO DE QUEDA,IBURA,UR 02,AV QUIXERAMOBIM,Arvores em Risco,-1,-8.1223341,-34.9546082,google maps api,LVd2
8017295016,2016-04-16,00:50,USUARIA SOLICITA UMA VISTORIA EM SEU IMOVEL MORA PROXIMO A MARE QUE TRANSBORDOU E ESTA ALAGADA E NÃO TEVE VITIMA MAS SOLICITA URGENCIA POIA A MESMA INFORMA QUE POSSUI UM LUGAR PARA ONDE IR E POSSUI CRIANÇA,IBURA,IBURA DE BAIXO,"RUA PONTE PRETA, SN",Imoveis Alagados,-1,-8.0355716,-34.9834458,google maps api,PV1
8019533616,2016-04-25,10:51,usuaria informa que esta tendo invasao no terreno interditado,IBURA,JD. MONTE VERDE,rua sao joao,Invasao de Terreno de Auxilio Moradia,-1,-8.1105568,-34.93699350000001,google maps api,LVd2
8017820816,2016-04-16,20:47,"USUÁRIA INFORMA QUE ESTÁ VAZANDO ÁGUA DE UMA OUTRA RESIDENCIA E ESTÁ INFILTRANDO NA SUA CASA, A MESMA INFORMA QUE O VAZAMENTO OCASIONOU EM RACHADURAS E SOLICITAV URGÊNCIA.",IBURA,ALTO DA BELA VISTA,"RUA RIO ESPERA N, 230",Imoveis Alagados,-1,-8.1208537,-34.9395867,google maps api,LVd2
8018166016,2016-04-18,09:40,USUÁRIO INFORMA QUE TERCEIROS INVADIRAM UM TERRENO DESOCUPADO PELA SEDEC E CONSTRUIRAM UMA CASA. URGENTE.,IBURA,JD. MONTE VERDE,RUA MONICA RAPOSO.,Invasao de Terreno de Auxilio Moradia,-1,-8.1149907,-34.9564438,google maps api,PV1
8080393616,2016-12-31,16:46,USUÁRIA SOLICITA A VISTORIA EM SUA RESIDENCIA QUE ESTÁ EM RISCO POR CONTA  DE UM VAZAMENTO DO SEU VIZINHO QUE OCORRE A QUATRO ANOS.,IBURA,UR 02,"RUA SIQUEIRA CAMPOS N, 280",Alagamentos,-1,-8.1119189,-34.9544981,google maps api,PV1
8065683716,2016-10-21,17:27,USUARIA RELATA QUE ESTAO  INVADINDO TERRENO DE ÁREA VERDE,IBURA,UR 04,rua capitao pedro miranda s n,Invasao de Terreno de Auxilio Moradia,-1,-8.1289205,-34.9458192,google maps api,LVd2
8065735716,2016-10-24,14:23,USUÁRIO INFORMA QUE PESSOAS INVADIRAM O TERRENO E QUE ESTÃO CONSTRUINDO CASAS,IBURA,UR 04,RUA CAPITÃO PEDRO MIRANDA,Invasao de Terreno de Auxilio Moradia,-1,-8.1289205,-34.9458192,google maps api,LVd2
8060787916,2016-09-29,12:09,"TERRENO INTERDITADO E INDENIZADO, FOI INVADIDO E ESTÃO CONSTRUINDO O IMOVEL.",IBURA,JD. MONTE VERDE,RUA SERRA DA MONTIQUIRA,Invasao de Terreno de Auxilio Moradia,-1,-8.1105568,-34.93699350000001,google maps api,LVd2
8059625916,2016-09-24,09:08,"TERRENO DE AUXILIO MORADIA FOI INVADIDO E A DONA DA MESMA ESTÁ DENUNCIANDO QUE ESTÃO CONSTRUINDO CASA, PEDE URGENCIA.",IBURA,JD. MONTE VERDE,RUA SÃO JOÃO N  45,Invasao de Terreno de Auxilio Moradia,-1,-8.1093659,-34.9478938,google maps api,LVd2
8056044516,2016-09-08,12:48,"usuario relata que estao invadindo o seu terreno,a mesma esta recebendo auxilio moradia.",IBURA,JD. MONTE VERDE,rua sao joao n 45,Invasao de Terreno de Auxilio Moradia,-1,-8.1105568,-34.93699350000001,google maps api,LVd2
8048028416,2016-08-04,07:33,USUARIO INF QUE ESTAO INVADINDO UM TERRENO DE AUXILIO MORADIA. O MESMO INF QUE A AREA É DE RISCO,IBURA,LAGOA ENCANTADA,"RUA JORNALISTA NELSON RODRIGUES, AO LADO 215",Invasao de Terreno de Auxilio Moradia,-1,-8.1230455,-34.9508061,google maps api,LVd2
8049630016,2016-08-10,07:54,USUÁRIO INFORMA QUE MORADOR INVADIU TERRENO DE AUXÍLIO MORADIA E ESTAR CONSTRUINDO UMA CASA DE PRIMIERO ANDAR. URGENTE.,IBURA,UR 01,"RUA JAVALI, N 220.",Invasao de Terreno de Auxilio Moradia,-1,-8.1105568,-34.93699350000001,google maps api,LVd2
8050298516,2016-08-12,06:38,USUARIA INF QUE ESTAO CONSTRUINDO UM IMOVEL EM TERRENO CONDENADO. A MESMA PEDE PROVIDENCIAS.,IBURA,TRES CARNEIROS ALTO,"RUA   IBIAPORA, 45",Invasao de Terreno de Auxilio Moradia,-1,-8.1249872,-34.9547448,google maps api,LVd2
8042261916,2016-07-11,12:14,USUARIO INF QUE A ARVORE ESTA CAUSANDO RISCO DE QUEDA. USUARIO PEDE URGENCIA,IBURA,UR 10,"RUA POETA MARIO DE ALENCAR, 05",Arvores em Risco,-1,-8.1371571,-34.9523896,google maps api,A2
8041069716,2016-07-06,14:10,USUARIO INFORMA QUE TEM PESSOAS INVADINDO O TERRENO DA PREFEITURA,IBURA,UR 03,RUA ENGENHO CANAVIEIRA S N,Invasao de Terreno de Auxilio Moradia,-1,-8.1110384,-34.9494601,google maps api,LVd2
8045493816,2016-07-25,10:18,USUÁRIA SOLICITA CORTE DE ARVORES EM BARRIERA. URGENTE.,IBURA,LAGOA ENCANTADA,"RUA DEPUTADO JOAQUIM COUTINHO, N 06.",Arvores em Risco,-1,-8.1279938,-34.9500915,google maps api,LVd2
8039564416,2016-06-30,17:22,USUARIO SOLICITA A VISOTRIA EM ARVORE COM RISCO DE QUEDA SOBRE A SUA CASA.,IBURA,VILA DOS MILAGRES,"1 TRV DOS MILAGRES N, 23",Arvores em Risco,-1,-8.1105568,-34.93699350000001,google maps api,LVd2
8039300716,2016-06-29,20:19,USUÁRIO INFORMA QUE ESTA ACONTECENDO INVASÃO NESSE EXATO MOMENTO EM UMA AREA DE RISCO PEDE BREVIDADE E SIGILO,IBURA,UR 04,RUA CAPITAO PEDRO MIRANDA S N,Invasao de Terreno de Auxilio Moradia,-1,-8.1289205,-34.9458192,google maps api,LVd2
8039200216,2016-06-29,15:09,USUARIO SOLICITA VISTORIA EM ARVORE COM RISCO DE QUEDA SOBRE A SUA ESIDENCIA,IBURA,UR 02,"RUA CAJUEIRO N,04",Arvores em Risco,-1,-8.1185542,-34.9424592,google maps api,LVd2
8036228117,2017-05-03,09:03,USUÁRIO SOLICITA A ERRADICAÇÃO DA ARVORE ESTA INCLINADA  ESTA COM RISCO DE CAIR POR CIMA DA RESIDENCIAS PEDE URGÊNCIA  PEDE URG,IBURA,UR 02,"AV   ANGRA DOS REIS N, 415",Arvores em Risco,-1,-8.1208308,-34.9573483,google maps api,LVd2
8033619017,2017-04-24,10:12,usuario deseja a vistoria em um pe de jaca que esta com risco iminente de queda.,IBURA,TRES CARNEIROS BAIXO,"av campo verde,84",Arvores em Risco,-1,-8.122896299999999,-34.9539719,google maps api,LVd2
8035513417,2017-04-28,13:44,solicita vistoria em sala de aula em escola pois ocorreu incêndio verificar risco de queda ! incêndio ontem a noite!,IBURA,UR 03,venida Engenho Muribara  sn,Incendios,-1,-8.111928,-34.9501038,google maps api,LVd2
8032933217,2017-04-20,08:15,"USUARIA DENUNCIA INVASÃO DE TERRENO CONDENADO, REQUER URGENCIA.",IBURA,UR 01,"RUA GONÇALVES CRESPO, N  15",Invasao de Terreno de Auxilio Moradia,-1,-8.1168262,-34.9500866,google maps api,LVd2
8030067617,2017-04-11,10:08,usuário informa que invadiram terreno que seu irmão morava e foi condenado pela defesa civil *,IBURA,TRES CARNEIROS ALTO,rua esperança do oeste 51,Invasao de Terreno de Auxilio Moradia,-1,-8.1232399,-34.956409,google maps api,LVd2
8025715317,2017-03-29,08:21,"USUÁRIA SOLICITA VISTORIA DE TERRENO DO AUXILIO MORADIA QUE FOI INVADIDO POR TERCEIROS PARA CONSTRUÇÃO, O MESMO JÁ FOI CERCADO COM UM MURO.",IBURA,TRES CARNEIROS ALTO,RUA CURILANDIA N 281,Invasao de Terreno de Auxilio Moradia,-1,-8.1105568,-34.93699350000001,google maps api,LVd2
8035028917,2017-04-27,10:38,USUÁRIO SOLICITA VISTORIA DE UM TERRENO INTERDITADO EM QUE ESTA SENDO CONSTRUINDO RESIDENCIA NO LOCAL. OBS: A CONSTRUÇÃO FICA EM FRENTE A CASA DE GRAÇA,IBURA,JD. MONTE VERDE,RUA PICO DA BANDEIRA SN,Invasao de Terreno de Auxilio Moradia,-1,-8.1139296,-34.9589485,google maps api,PV1
8016365317,2017-02-26,18:58,USUARIO INFORMA QUE SUA RESIDENCIA PEGOU FOGO E O CORPO DE BOMBEIROS APAGOU O FOGO A DUAS HORAS ATRAS. O MESMO INFORMA QUE ELES PEDIRAM PARA A MORADORA ENTRAR EM CONTATO PARA SOLICITAR UMA VISTORIA COM URGENCIA PARA VERIFICAR A ESTRUTURA DO IMOVEL.,IBURA,JD. MONTE VERDE,Rua Cento e Trinta e Cinco N12,Incendios,-1,-8.1132596,-34.9590673,google maps api,PV1
8016454617,2017-03-02,09:48,"TERRENO JÁ INDENIZADO ESTÁ SENDO INVADIDO E CONSTRUINDO DE FORMA IRREGULAR, USUARIO ALEGA QUE TA CORRENDO RISCO.",IBURA,UR 02,"RUA JOÃO CORDEIRO DE SOUZA, N 194",Invasao de Terreno de Auxilio Moradia,-1,-8.123823,-34.9535156,google maps api,LVd2
8006265617,2017-01-24,11:09,invasão de terreno de auxilio moradia.,IBURA,TRES CARNEIROS BAIXO,"rua burilandia, n 56.",Invasao de Terreno de Auxilio Moradia,-1,-8.1242138,-34.9565696,google maps api,LVd2
8001609917,2017-01-09,08:37,usuária informa que moradores estão invadindo terreno desocupado pela sedec. urgente.,IBURA,UR 10,"1 trv luiz rodolfo de araujo junior, n 357.",Invasao de Terreno de Auxilio Moradia,-1,-8.0389302,-34.898107,google maps api,URBANO
8000998117,2017-01-05,09:29,usuaria relata que a arvore está apresentando muitos estralhos e podendo cair encima da casa vizinha.,IBURA,LAGOA ENCANTADA,"TRV DR  MOACIR SALES, n 33",Arvores em Risco,-1,-8.122851299999999,-34.95061640000001,google maps api,LVd2
8004937717,2017-01-19,09:22,informa que terreno condenado pela sedec está sendo invadido. favor verificar,IBURA,TRES CARNEIROS ALTO,rua ibiraçu,Invasao de Terreno de Auxilio Moradia,-1,-8.1244201,-34.9566558,google maps api,LVd2
8003853417,2017-01-16,14:02,USUÁRIA SOLICITA A VISTORIA EM ÁRVORE,IBURA,LAGOA ENCANTADA,"TRV DR MOACIR SALES N, 33",Arvores em Risco,-1,-8.122851299999999,-34.95061640000001,google maps api,LVd2
8052677117,2017-06-13,10:51,usuario diz que caiu um pedaço do muro porque ele foi podar a arvore que esta no meio do mesmo,IBURA,UR 03,"av engenho muribara,231",Arvores em Risco,-1,-8.1124586,-34.94985399999999,google maps api,LVd2
8053783017,2017-06-15,11:32,"ARVORE EM RISCO DE QUEDA ENCIMA DO TELHADO DA CASA DA SOLICITANTE, A MESMA APRESENTA TOMBAMENTO REQUER URGENCIA EM VISTORIA E CORTE SE POSSIVEL.",IBURA,UR 01,"RUA RAUL SOARES, N  450",Arvores em Risco,-1,-8.122684099999999,-34.9447069,google maps api,LVd2
8053849017,2017-06-15,12:20,USUARIA SOLICITA UMA VISTORIA DE UMA ARVORE ESTA INCLINADA COM RISCO DE QUEDA SOBRE AS RESIDENCIA NO LOCAL E SOLICITA URGENCIA,IBURA,UR 04,"AVENIDA MATOA GROSSO, 132",Arvores em Risco,-1,-8.122922299999999,-34.9462782,google maps api,LVd2
8053880517,2017-06-15,12:41,"USUÁRIO PEDE VISTORIA POIS UM TERRENO ESTÁ SENDO INVADIDO ,O MESMO FOI INTERDITADO PELA DEFESA CIVIL,ESTÃO CONSTRUINDO E TEM RISCO DE QUEDA.",IBURA,VILA DOS MILAGRES,RUA DA ASSEMBLEIA N 05,Invasao de Terreno de Auxilio Moradia,-1,-8.105677,-34.948616,google maps api,PV1
8048010617,2017-06-01,15:00,"USUÁRIO PEDE VISTORIA POIS TEM UMA ÁRVORE COM RISCO DE QUEDA,É UM PÉ DE AROEIRA PODE CAIR NA CASA DE UM MORADOR NA PARTE DE BAIXO.",IBURA,UR 12,AVENIDA JOÃO RIO BRANCO DE LIMA N 806,Arvores em Risco,-1,-8.1304457,-34.9523252,google maps api,LVd2
8048562917,2017-06-02,13:54,usuária informa que o terreno do auxilio moradia está sendo invadido. a mesma informa que já entrou em contato com a polícia militar . este disse que a competência do serviço é da codecipe.,IBURA,JD. MONTE VERDE,Rua são joão,Invasao de Terreno de Auxilio Moradia,-1,-8.1105568,-34.93699350000001,google maps api,LVd2
8047699017,2017-06-01,10:41,"usuário solicita corte de duas arvores em escadaria, próximo a canaleta, que está com riscos de cair por cima de duas casas. urgente.",IBURA,LAGOA ENCANTADA,"rua maria adelaide castelo branco, n 220.",Arvores em Risco,-1,-8.124259799999999,-34.9505512,google maps api,LVd2
8047851717,2017-06-01,12:40,usuário solicita erradicação de uma mangueira que esta com riscos de queda. urgente.,IBURA,UR 12,"rua cajueiro, n 30.",Arvores em Risco,-1,-8.129265499999999,-34.9339952,google maps api,LVd2
8040940417,2017-05-14,10:57,Usuário deseja vistoria houve queda de um pé de bambu (três pés de bambum ) .obs. ainda tem pé de manga oferecendo risco de queda !,IBURA,JD. MONTE VERDE,rua Lourival júnior 56,Arvores em Risco,-1,-8.115133,-34.957399,google maps api,PV1
8038935717,2017-05-09,13:02,USUÁRIO PEDE REPOSIÇÃO DE LONA PLÁSTICA NESSE LOCAL E REMOÇÃO DE UM PÉ DE COQUEIRO QUE AMEAÇA DESABAR.,IBURA,UR 03,AVENIDA PRESIDENTE MÉDICI N,Arvores em Risco,-1,-8.107243,-34.95664000000001,google maps api,PV1
8038956417,2017-05-09,13:49,"USUÁRIO PEDE VISTORIA NO LOCAL POIS UMA CANALETA ESTÁ ENTUPIDA CAUSANDO ALAGAMENTO E A MARE TMBÉM PROVOCA ALAGAMENTO NA RUA,CASAS E NA ESCOLA . CELULAR 987612211 SR MARCOS",IBURA,IBURA DE BAIXO,RUA PROFESSOR JOSE BRASILEIRO VILA NOVA,Alagamentos,-1,-8.1153219,-34.9323845,google maps api,LVd2
8038585617,2017-05-09,08:04,"REQUER VISTORIA POIS ARVORE APRESENTA RISCO, CONFORME A USUARIA INFORMA QUE ARVORE SITUADA NO TERRENO ESTÁ COM TOMBAMENTO.",IBURA,LAGOA ENCANTADA,"AV. DOZE DE JUNHO, N 1365",Arvores em Risco,-1,-8.1148693,-34.95226460000001,google maps api,LVd2
8037356317,2017-05-05,09:44,deseja vistoria estão invadindo terreno de auxilio moradia,IBURA,IBURA DE BAIXO,rua francisco beltrão 47,Invasao de Terreno de Auxilio Moradia,-1,-8.120294,-34.9401213,google maps api,LVd2
8037343917,2017-05-05,09:34,"USUÁRIA SOLICITA A VISTORIA DE TRÊS TERRENOS INTERDITADOS, ONDE AS FAMÍLIAS ESTÃO RECEBENDO O AUXILIO MORADIA ,PORÉM ESTÃO CONSTRUINDO CASAS NO LOCAL.",IBURA,IBURA DE BAIXO,"RUA FRANCISCO BELTRÃO N 35, 41 E 47",Invasao de Terreno de Auxilio Moradia,-1,-8.1274508,-34.9341665,google maps api,LVd2
8068750517,2017-07-29,09:58,USUÁRIO INFORMA QUE UM COQUEIRO DENTRO DE UM TERRENO PRIVADO ESTÁ TRAZENDO RISCOS PARA A LOCALIDADE E OS GALHOS ESTÃO BATENDO NOS FIOS DE REDE DA CELPE E ESTÁ COM RISCO DE QUEDA O MESMO INFORMOU QUE UMA EQUIPE DA DEFESA CIVIL INDICOU QUE ELE ENTRASSE EM CONTATO COM A CENTRAL DE ATENDIMENTO.,IBURA,JD. MONTE VERDE,RUA CENTO E TRINTA E CINCO,Arvores em Risco,-1,-8.1132596,-34.9590673,google maps api,PV1
8059822717,2017-07-05,08:45,deseja vistoria em coqueiro e goiabeira cheia de cupim com risco de queda na cada da vizinha,IBURA,UR 12,rua joao rio branco de lima 465,Arvores em Risco,-1,-8.127120099999999,-34.9530267,google maps api,LVd2
8059522317,2017-07-04,11:41,COLOCAÇÃO DE LONA PLASTICA  E VISTORIA EM ABACATEIRO  COM RISCO DE QUEDA,IBURA,VILA DOS MILAGRES,RUA DOS MILAGRES 01 A,Arvores em Risco,-1,-8.1087034,-34.9482116,google maps api,LVd2
8068551217,2017-07-28,12:59,"USUARIO SOLICITA A VISTORIA EM ARVORE LOCALIZADA EM SEU TERRENO. ARVORE DE GRANDE PORTE, INCLINADA PARA SUA RESIDENCIA.",IBURA,VILA DOS MILAGRES,RUA MORRO DO PILAR,Arvores em Risco,-1,-8.1220302,-34.9581313,google maps api,A2
8067544217,2017-07-26,13:46,CANO DA COMPESA ESTA ESTOURADO DANIFICANDO CASAS E ESCADARIAS,IBURA,UR 01,RUA GONCALVES CRESPO,Imoveis Alagados,-1,-8.1172989,-34.9502808,google maps api,LVd2
8065951017,2017-07-20,20:15,"USUÁRIO INFORMA QUE AS SUAS 2 ÁRVORES ESTÃO COM CUPINS, O MESMO DIZ QUE JÁ CAIU GRANDES GALHAS E QUE CONTINUAM EM RISCO.",IBURA,ASA BRANCA,"SEGUNDA TRAVESSA JORNALISTA NELSON RODRIGUES, N 35",Arvores em Risco,-1,-8.1258372,-34.9488044,google maps api,LVd2
8065145317,2017-07-19,00:00,USUARIO INFORMA QUE A ARVORE ESTA OFERECENDO RISCO EMINENTE DE QUEDA E PEDA URGENCIA SE POSSIVEL.,IBURA,UR 10,RUA LUIS RODOLFO N16,Arvores em Risco,-1,-8.1391615,-34.9547662,google maps api,A2
8065330517,2017-07-19,11:56,deseja vistoria em coqueiro que esta caindo pra casa da vizinha,IBURA,JD. MONTE VERDE,rua segunda travessa serra da mantiqueira 329,Arvores em Risco,-1,-8.1116826,-34.9587716,google maps api,PV1
8062896817,2017-07-11,20:54,USUÁRIA  INFORMA QUE ARVORE DE GRANDE PORTE QUE SE LOCALIZA NO INTERIOR DO SEU IMÓVEL ESTA  RACHANDO E ESTA CAINDO POR CIMA DA CASA A MESMA INFORMA QUE DEVIDO A ESTE PROBLEMA RACHOU A PAREDE DA SUA RESIDENCIA FAVOR VERIFICAR COM URGÊNCIA FALAR COM SR EDGAR (81)988170576,IBURA,VILA DOS MILAGRES,RUA NOSSA SRA DO CARMO,Arvores em Risco,-1,-8.105677,-34.948616,google maps api,PV1
8061373117,2017-07-07,11:35,"USUÁRIO INFORMA QUE APÓS A CONSTRUÇÃO DA RUA, CASA DO SR. SEVERINO FICOU MUITO ABAIXO DO NIVEL DA RUA, CAUSANDO ALAGAMENTO SEMPRE QUE CHOVE.O MESMO É IDOSO E PORTADOR DE DIABETES O QUE DIFICULTA AINDA MAIS A VIVENCIA NO LOCAL.",IBURA,IBURA DE BAIXO,RUA RIO DOURO,Imoveis Alagados,-1,-8.114773699999999,-34.9399567,google maps api,LVd2
8061557517,2017-07-07,15:13,"USUARIO INFORMA QUE EXISTEM TRES ARVORES QUE ESTAO BALANÇANDO DENTRO DO CONDOMINIO VALE DOS RIOS 1, PODENDO CAUSAR ALGUM TIPO DE ACIDENTE.",IBURA,IBURA DE BAIXO,RUA RIO PAJEU,Arvores em Risco,-1,-8.114773699999999,-34.9399567,google maps api,LVd2
8061919417,2017-07-10,10:11,USUÁRIO INFORMA QUE INVADIRAM SEU TERRENO CONDENADO PELA DEFESA CIVIL E ESTÃO FAZENDO CONSTRUÇÃO  IRREGULAR FAVOR VERIFICAR POIS HÁ RISCO DE QUEDA,IBURA,TRES CARNEIROS ALTO,RUA GURIU ANTIGA RUA 6,Invasao de Terreno de Auxilio Moradia,-1,-8.1105568,-34.93699350000001,google maps api,LVd2
8061155417,2017-07-07,08:35,USUÁRIO INFORMA QUE NA CASA DE SEU VIZINHA HÁ UMA ÁRVORE DE GRANDE PORTE CUJO GALHO SE ENCONTRA DIRECIONADA PARA SUA CASA.PROPRIETÁRIO DA ÁRVORE NÃO AUTORIZA O CORTE DO GALHO QUE PÕE EM RISCO A RESIDÊNCIA DA SOLICITANTE.PEDE SOCORRO A DEFESA CIVIL,IBURA,IBURA DE BAIXO,RUA CRISTINO DE CASTRO,Arvores em Risco,-1,-8.1251401,-34.9359382,google maps api,LVd2
8060133717,2017-07-05,13:08,USUARIA INFORMA QUE UM PE DE CORAÇAO DE NEGRO QUE ESTA PENDENDO. CONTATO CEL: 81 85281715,IBURA,UR 04,RUA CAPITAO VICENTE CURADO,Arvores em Risco,-1,-8.1289205,-34.9458192,google maps api,LVd2
8054067617,2017-06-15,15:47,"USUÁRIO SOLICITA A VISTORIA EM CASA, A MESMA INFORMA QUE UMA ÁRVORE CAIU EM CIMA DA CASA",IBURA,JD. MONTE VERDE,RUA ALTO DO CAXAMBU,Arvores em Risco,-1,-8.115979,-34.9571514,google maps api,PV1
8054728217,2017-06-19,08:12,USUÁRIO SOLICITA A VISTORIA DE UM TERRENO INTERDITADO QUE FOI INVADIDO E ESTÃO SENDO CONSTRUÍDAS BASES PARA CONSTRUÇÕES DE CASAS.,IBURA,27 DE NOVEMBRO,RUA GETULIO VARGAS SN,Invasao de Terreno de Auxilio Moradia,-1,-8.1105568,-34.93699350000001,google maps api,LVd2
8026869218,2018-02-28,19:50,USUÁRIA INFORMA QUE SEU TERRENO FOI INVADIDO E QUE TERCEIROS JÁ CONSTRUÍRAM UM IMÓVEL NO LOCAL.,IBURA,IBURA DE BAIXO,RUA FRANCISCO BELTRÃO,Invasao de Terreno de Auxilio Moradia,-1,-8.1251401,-34.9359382,google maps api,LVd2
8009229918,2018-01-20,08:47,USUÁRIA INFORMA QUE TEM DENTRO DO QUINTAL UM PE DE COQUEIRO QUE ESTA ALTO E USUÁRIO DIZ QUE TEM UMA BAREIRA DE PEQUENO PORTE. INFORMAI QUE A DEFESA CIVIL SO IRIA ORIENTA LO POIS NAO TEM RISCO.,IBURA,JD. MONTE VERDE,RUA CENTO E TRINTA E CINCO N 15,Arvores em Risco,-1,-8.113852,-34.959285,google maps api,PV1
8008324818,2018-01-19,08:45,USUÁRIO INFORMA QUE DESDO ANO PASSADO QUE HÁ DUAS ARVORES DE GRANDE PORTE TOTALMENTE INCLINADOS PARA CASA DE VIZINHOS E A RAIZ ESTA TODA EXPOSTA E COM AS CHUVAS CADA VEZ MAS ESTA A INCLINAR FAVOR VERIFICAR O MESMO PEDI URGÊNCIA POIS A QUALQUER MOMENTO PODE CAIR,IBURA,IBURA DE BAIXO,RUA REGENTE FEIJÓ N 529,Arvores em Risco,-1,-8.1251531,-34.9392258,google maps api,LVd2
8006618418,2018-01-17,15:59,"USUÁRIA SOLICITA VISTORIA PARA TERRENO QUE FORA INVADIDO POR MORADORES LOCAIS,QUE ESTÁ SENDO VENDIDO INDEVIDAMENTE, QUE JÁ FORA INTERDITADO PELA SEDEC. EXISTEM PLANTAÇÕES NESTE TERRENO E UM BARRACO JÁ CONSTRUÍDO.SÃO DUAS BARREIRAS E,A CONSTRUÇÃO FICA ENTRE ELAS.OFERECE RISCOS PARA TODOS OS MORADORES DA LOCALIDADE,ALÉM DO LIXO QUE ESTÁ SENDO JOGADO PARA AS CASAS PRÓXIMAS.",IBURA,UR 12,Rua Mandioré   S N,Invasao de Terreno de Auxilio Moradia,-1,-8.0540816,-34.9249266,google maps api,URBANO
8115327217,2017-12-15,11:13,USUÁRIA INFORMA QUE A SENHORA FERNANDA KELLY TEVE SUA CASA CONDENADA PELA DEFESA CIVIL E AINDA CONTINUA MORANDO NA RESIDENCIA A ESTA RECEBENDO O AUXILIO MORADIA FAVOR VERIFICAR AS INFORMAÇÕES,IBURA,UR 10,RUA CONTINENTAL N 478,Invasao de Terreno de Auxilio Moradia,-1,-8.1348548,-34.94814119999999,google maps api,LVd2
8096049617,2017-10-18,15:29,USUÁRIA SOLICITA VISTORIA PARA MORADOR QUE ESTÁ CONSTRUINDO UMA CASA DE MADEIRA EM LOCAL QUE FORA DESAPROPRIADO PELA SEDEC SENDO LOCAL DE RISCO.RECEBEM AUXÍLIO MORADIA.,IBURA,JD. MONTE VERDE,RUA PARNAIOCA S N,Invasao de Terreno de Auxilio Moradia,-1,-8.1105568,-34.93699350000001,google maps api,LVd2
8087839817,2017-09-26,17:56,"o usuario informa que no local se encontra um pé de manga, um pé de coco e um de abacate em area de barrreira que está em risco de cair qualquer momento,favor verificar com urgencia. outro contt: 91609526.",IBURA,UR 02,RUA   ENGENHO NORUEGA,Arvores em Risco,-1,-8.1117913,-34.9570873,google maps api,PV1
8097895817,2017-10-24,12:24,"DENUNCIA: USUÁRIO INFORMA QUE EXISTE UM TERRENO DA PREFEITURA QUE FUNCIONÁRIOS ESTÃO CONSTRUINDO UM CANAL PARA POSTERIORMENTE CONSTRUIR UMA PRAÇA E TERCEIROS OCUPARAM O LOCAL FAZENDO COM QUE A CONSTRUÇÃO FOSSE EMBARGADA. A MESMA INFORMA QUE SÃO DA FAVELA TERRA NOSSA E ELES POSSUEM ARMAS ONDE NÃO QUEREM DESOCUPAR O LOCAL, CAUSANDO TRANSTORNOS AOS MORADORES PRÓXIMOS.",IBURA,IBURA DE BAIXO,"RUA ENGENHO BULHOES, N  130 131",Invasao de Terreno de Auxilio Moradia,-1,-8.1158921,-34.937708,google maps api,LVd2
8084312917,2017-09-15,13:40,USUÁRIA INFORMA QUE EXISTE UMA ÁRVORE (GP) QUE ESTA CORRENDO RISCO DE CAIR POR CIMA DA RESIDÊNCIA. FAVOR VERIFICAR COM URGÊNCIA.,IBURA,UR 12,"RUA FRANCISCO CAJUEIRO, N  37",Arvores em Risco,-1,-8.1200612,-34.9404861,google maps api,LVd2
8081780117,2017-09-06,12:16,"USUÁRIA INFORMA QUE ALGUÉM INVADIU TERRENO DE AUXÍLIO MORADIA.TERRENO ESTÁ SENDO CAPINADO PARA QUE SEJA CONSTRUÍDO UMA CASA.A USUÁRIA INFORMA QUE FOI VENDIDO POR 1.500,00. SOLICITA VISTORIA.",IBURA,TRES CARNEIROS BAIXO,RUA PURILANDIA  S N,Invasao de Terreno de Auxilio Moradia,-1,-8.1242138,-34.9565696,google maps api,LVd2
8073954417,2017-08-14,16:07,USUÁRIA INFORMA QUE EXISTEM TRÊS ARVORES (EMBAÚBA) QUE ESTA CORRENDO RISCO DE CAIR NA CASA DA USUÁRIA. A MESMA INFORMA QUE JÁ ENTROU EM CONTATO COM ISMAEL E RAFAEL E OS MESMO DISSERAM PARA ELA QUE IRIAM MANDAR A EQUIPE NO LOCAL FAZER A VISTORIA.,IBURA,LAGOA ENCANTADA,"RUA JAGUARIAIVA, N  945",Arvores em Risco,-1,-8.1177307,-34.9534313,google maps api,LVd2
8074011617,2017-08-15,09:07,"USUÁRIA INFORMA QUE DEVIDO A ARVORE ESTA TODA ENRAIZADA JA POR BAIXO DA CAS E APARECEU RACHADURAS BANHEIRO, PROCURAR CEÇA OU MARCOS CABEÇA.",IBURA,UR 02,RUA TRAVESSA NORUEGA N 08,Arvores em Risco,-1,-8.1105568,-34.93699350000001,google maps api,LVd2
8088051517,2017-09-27,12:06,arvore esta caindo em cima da casa da usuária. pé de eucalipto,IBURA,UR 03,av presidente mendes  n  900,Arvores em Risco,-1,-8.107243,-34.95664000000001,google maps api,PV1
8072995917,2017-08-10,15:27,"USUÁRIO SOLICITA VISTORIA PARA ÁRVORE TAMARINEIRA(GP)FICA NO QUINTAL DO VIZINHO, INFORMA QUE ESTÁ INCLINADA PARA OUTRAS CASAS OFERECENDO RISCO DE QUEDA.TERRENO PLANO MAS ESTÁ PERTO DO MURO DE ARRIMO E MURO DE VIZINHOS.",IBURA,LAGOA ENCANTADA,RUA DR CESAR MONTEZUMA 75 A,Arvores em Risco,-1,-8.1288783,-34.9504729,google maps api,LVd2
8072582418,2018-06-07,10:21,A USUARIA INFORMA QUE O TERRENO DE SEU ESPOSO INTERDITADO PELO SEDEC FOI INVADIDO.,IBURA,JD. MONTE VERDE,"RUA  DAS ARARAS, N 46",Invasao de Terreno de Auxilio Moradia,-1,-8.1105568,-34.93699350000001,google maps api,LVd2
8058575418,2018-05-04,13:33,USUÁRIO INFORMA QUE TEM UMA ARVORE NA CASA DE SEU VIZINHO QUE ESTÁ OFERECENDO RISCO DE CAIR E ATINGIR SUA RESIDENCIA.,IBURA,UR 02,"RUA ENGENHO NORUEGA , N 77",Arvores em Risco,-1,-8.113717399999999,-34.9573276,google maps api,PV1
8058915018,2018-05-05,09:21,"USUÁRIO SOLICITA CORTE DE ÁRVORE QUE ESTÁ OFERECENDO PERIGO PARA A RESIDENCIA DO CIDADÃO, UM PÉ DE UBAUBA.",IBURA,IBURA DE BAIXO,RUA RIO PURUS 84,Arvores em Risco,-1,-8.1181281,-34.943121,google maps api,LVd2
8067661718,2018-05-25,11:32,"A USUARIA INFORMA QUE ESTÁ SENDO FEITO UMA CONSTRUÇÃO IRREGULAR EM UM TERRENO INTERDITADO PELO SEDEC,FAVOR VERIFICAR COM URGENCIA.",IBURA,JD. MONTE VERDE,"4TRV CHAPADA DO ARARIPE, N137",Invasao de Terreno de Auxilio Moradia,-1,-8.120782199999999,-34.9603141,google maps api,PV1
8066830018,2018-05-23,12:18,"USUÁRIO INFORMA QUE TEM UMA ARVORE QUE ESTA AMEAÇANDO CAIR EM SUA RESIDENCIA , O MESMO INFORMA QUE O FISCAL DA ÁREA PEDIU PRA ELE LIGAR  .",IBURA,JD. MONTE VERDE,RUA PICO DA BANDEIRA,Arvores em Risco,-1,-8.1139296,-34.9589485,google maps api,PV1
8063325218,2018-05-15,14:04,USUÁRIO INFORMA QUE HÁ UM PÉ DE JACA RACHADO CORRENDO O RISCO DE CAIR EM CIMA DE UMA RESIDÊNCIA.,IBURA,JD. MONTE VERDE,RUA PICO DA NEBLINA,Arvores em Risco,-1,-8.1182012,-34.9570858,google maps api,PV1
8051714918,2018-04-22,08:30,"A USUARIA SOLICITA VISTORIA NA CASA DELA , INFORMANDO QUE A ÁGUA QUE ESTA DESCENDO ESTA ALAGANDO A CASA DA MESMA E INFILTRANDO A PAREDE .",IBURA,TRES CARNEIROS BAIXO,RUA IRATINGA N 139,Alagamentos,-1,-8.1278816,-34.9582784,google maps api,A2
8052897018,2018-04-24,10:08,"A USUARIA INFORMA QUE A CANALETA DE ESCADARIA ESTÁ DESCENDO ÁGUA EM DIREÇÃO AO  SEU QUARTO,FAVOR VERIFICAR URGENCIA, POIS ESTÁ ALAGANDO E DEIXANDO MUITO MAL CHEIRO DENTRO DE SUA CASA.",IBURA,TRES CARNEIROS BAIXO,RUA IRATINGA,Alagamentos,-1,-8.1280079,-34.9574619,google maps api,A2
8054215318,2018-04-26,07:44,"O USUARIO INFORMA QUE NO LOCAL SE ENCONTRA UMA ARVORE COM RISO DE QUEDA,FAVOR VERIFICAR.O MESMO INFORMA QUE PODE CAIR EM DIREÇÃO A SUA RESIDENCIA.",IBURA,UR 01,"RUA JORNALISTA  NELSON RODRIGUES,N 176",Arvores em Risco,-1,-8.1248,-34.9485247,google maps api,LVd2
