processo_numero,solicitacao_data,solicitacao_hora,solicitacao_descricao,solicitacao_bairro,solicitacao_localidade,solicitacao_endereco,processo_ocorrencia,is_confirmed,latitude,longitude,location_strategy,ground_type
8005018122,2022-01-15,08:35,USUÁRIA INFORMA QUE TERRENO CONDENADO E INDENIZADO PELA DEFESA CIVIL FOI INVADIDO E ESTA SENDO CONSTRUÍDO UM PRIMEIRO ANDAR NO LOCAL.,NOVA DESCOBERTA,NOVA DESCOBERTA,"RUA SEGUNDA TRAVESSA MARIPA, SN",Invasao de Terreno de Auxilio Moradia,-1,-8.0123213,-34.923752,google maps api,A2
8079205121,2021-09-02,11:13,USUARIA INFORMA QUE SUA RESIDENCIA FOI INVADIDA QUE JA FOI INTERDITADA PELA DEFESA CIVIL.PEDE URGÊNCIA DA EQUIPE NO LOCAL,NOVA DESCOBERTA,CGO. DO JOAQUIM,RUA SELVES N 96,Invasao de Terreno de Auxilio Moradia,-1,-7.9989373,-34.932286,google maps api,LVd4
8086871321,2021-09-28,11:17,O USUARIO INFORMA QUE NO LOCAL SE ENCONTRA UMA ARVORE COM NECESSIDADE DE PODAMENTO.,NOVA DESCOBERTA,OLHO DAGUA,RUA FRANCISCO GOMES MACHADO 1N 8,Arvores em Risco,-1,-8.008746499999999,-34.9242156,google maps api,A2
8063677621,2021-07-21,12:23,SR SOLICITA A RETIRADA DA ARVORE QUE ESTA EM RISCO,NOVA DESCOBERTA,CGO. DO INACIO,RUA HERVAL SECO N162,Arvores em Risco,-1,-7.9964558,-34.9314931,google maps api,LVd4
8061009621,2021-07-12,12:22,"SRA SOLICITA A COLOCAÇAO DE LONAS EM DUAS BARREIRAS, CAPINAÇAO EM UMA DELAS E A PODA DE UMA ARVORE",NOVA DESCOBERTA,ALTO JD. PROGRESSO,RUA CRICIUMA N221,Arvores em Risco,-1,-8.0029141,-34.9259624,google maps api,LVd4
8061527721,2021-07-13,15:15,USUÁRIO SOLICITA ERRADICACAO DE ARVORE POIS INFORMA QUE ESTA COM RISCO DE QUEDA.,NOVA DESCOBERTA,ALTO DO RESERVATORIO,RUA ALTO DO RESERVATORIO N 277,Arvores em Risco,-1,-7.997706000000001,-34.9336468,google maps api,LVd4
8055351821,2021-06-22,09:29,usuário solicita retirada em 1 arvore que esta pendendo para cair,NOVA DESCOBERTA,OLHO DAGUA,rua nova esperança n 11,Arvores em Risco,-1,-8.010079000000001,-34.9234205,google maps api,A2
8059956121,2021-07-07,16:30,SOLICITA VISTORIA DE UM PÉ DE COCO QUE ESTÁ INCLINADO PARA A RESIDÊCIA E CAINDO MUITOS FRUTOS.,NOVA DESCOBERTA,ALTO DO REFUGIO,"RUA SACAMBU, N 60",Arvores em Risco,-1,-7.9983647,-34.9280494,google maps api,LVd4
8055349321,2021-06-22,09:27,usuário solicita retirada em 1 arvore que esta pendendo para a escola.,NOVA DESCOBERTA,ALTO JD. PROGRESSO,rua sobral pinto n 228,Arvores em Risco,-1,-8.003298,-34.9254061,google maps api,LVd4
8054643521,2021-06-18,13:02,USUÁRIO SOLICITA POSSÍVEL ERRADICAÇÃO DE TRÊS COQUEIROS E UMA MANGUEIRA,NOVA DESCOBERTA,ALTO SANTA LUZIA,"RUA ALTO SANTA LUZIA, 94",Arvores em Risco,-1,-8.0040851,-34.9330242,google maps api,LVd4
8045003721,2021-05-18,06:23,SOLICITA VISTORIA EM CASA ATINGIDA POR ÁRVORE,NOVA DESCOBERTA,NOVA DESCOBERTA,"AV VEREADOR OTACILIO AZEVEDO, 4580B",Arvores em Risco,-1,-7.9965052,-34.9252487,google maps api,LVd4
8041108921,2021-05-10,11:05,USUÁRIO SOLICITA COLOCAÇÃO DE LONA E CORTE DE UMA ÁRVORE,NOVA DESCOBERTA,NOVA DESCOBERTA,"RUA MACATUBA, 5132 A",Arvores em Risco,-1,-8.0095134,-34.9255628,google maps api,A2
8040327921,2021-05-06,13:28,VISTORIA EM ÁRVORE (PÉ DE BANANEIRA / CORTAR) E COLOCAÇÃO DE LONAS PLÁSTICAS PRECISA CAPINAR,NOVA DESCOBERTA,CGO. DA JOSELIA,RUA CRISTAL N887,Arvores em Risco,-1,-8.0049884,-34.9289175,google maps api,LVd4
8064290622,2022-06-08,10:50,deseja vistoria na casa que inundou e perdeu tudo.,NOVA DESCOBERTA,CGO. DA AREIA,1 tgravessa chagas ferreira n 23,Imoveis Alagados,-1,-8.0066375,-34.9088805,google maps api,URBANO
8001431520,2020-01-06,15:31,USUÁRIO INFORMA QUE O TERRENO DELE FOI CONDENADO PELA SEDEC E RECEBE AUXILIO E INFORMA QUE TEM TERCEIROS INVADINDO TERRENO.,VASCO DA GAMA,CGO. DO BOTIJAO,RUA SANTA MARIA GORETE N 4018,Invasao de Terreno de Auxilio Moradia,-1,-8.0122166,-34.918635,google maps api,A2
8001042920,2020-01-05,17:16,"TRATA SE DE INVASÃO DE TERRENO DE AUXILIO MORADIA, ANTIGO MORADOR SOLICITA PRESENÇA DA EQUIPE NO LOCAL.",VASCO DA GAMA,CGO. DO BOTIJAO,RUA SANTA  MARIA GORETTI,Invasao de Terreno de Auxilio Moradia,-1,-8.0122166,-34.918635,google maps api,A2
8062805922,2022-06-06,16:27,USUÁRIA INFORMA QUE TEM UMA ARVORE COM RISCOS NO LOCAL!,NOVA DESCOBERTA,ALTO DR. CAETES,ALTO JARDIM PROGRESSO N.889,Arvores em Risco,-1,-8.0055003,-34.9304367,google maps api,LVd4
8061705022,2022-06-03,20:48,"USUÁRIA SOLICITA VISTORIA, PRA VERIFICAR UM COQUEIRO QUE FICA LOCALIZADO EM UMA ÁREA QUE DESLIZA DIARIAMENTE, SEGUNDO ELA ESSA ARVORE FRUTÍFERA É BEM GRANDE, E PODE CAIR A QUALQUER MOMENTO. É NECESSÁRIO CAPINAÇÃO E COLOCAÇÃO DE LONAS PLASTICAS",NOVA DESCOBERTA,CGO. DO INACIO,Sub. do Joaquim n 98,Arvores em Risco,-1,-7.9971886,-34.9303789,google maps api,LVd4
8063320922,2022-06-07,10:38,"USUARIO INFORMA CASA ALAGADA COM RACHADURAS, PISO COM UMA CRATERA. SOLICITA VISTORIA.",NOVA DESCOBERTA,NOVA DESCOBERTA,"3A TRAV CHAGAS FERREIRA, 80",Alagamentos,-1,-8.0065665,-34.9088677,google maps api,URBANO
8063573422,2022-06-07,13:48,VERIFICAR ESTRUTURA DA CASA SE HÁ CONDIÇÕES DE MORADIA,NOVA DESCOBERTA,NOVA DESCOBERTA,RUA SITIO DOS NOBRES N 21,Imoveis Alagados,-1,-7.9974209,-34.9249979,google maps api,LVd4
8064110822,2022-06-08,08:44,USUARIO INFORMA ARVORE EM RISCO DE CAIR SOBRE A CASA. SOLICITA VISTORIA.,NOVA DESCOBERTA,NOVA DESCOBERTA,"RUA  VILA BOA VISTA, 335",Arvores em Risco,-1,-7.9957364,-34.9257898,google maps api,LVd4
8063159322,2022-06-07,08:56,um pe de azeitona e pe de abacate mais de 5 metros e esta prestes a cair nas casas abaixo.,NOVA DESCOBERTA,ALTO JD. PROGRESSO,rua alto jardim progresso n 800,Arvores em Risco,-1,-8.0055145,-34.93019,google maps api,LVd4
8072381722,2022-06-27,17:16,SRA SOLICITA A COLOCAÇAO DA LONA E A RETIRADA DE UMA ARVORE QUE ESTA OFERECENDO RISCO PARA A RESIDENCIA,NOVA DESCOBERTA,NOVA DESCOBERTA,1SB DO COMISSARIO N04,Arvores em Risco,-1,-7.999621599999999,-34.9281835,google maps api,LVd4
8061843422,2022-06-04,12:36,DUAS CASAS DESABARAM E A  USUÁRIA MORA PERTO DO RIO E ALAGOU DESABOU TUDO. ELA SOLICITA A VISTORIA PARA SER BENEFICIADA PELO AUXÍLIO MORADIA.OUTRO CONTATO:  95977031 / JULIANA 87023947 ROMILDO,NOVA DESCOBERTA,ALTO DO REFUGIO,RUA  SITIO DOS NOBRES,Alagamentos,-1,-7.997447,-34.9243806,google maps api,LVd4
8067377522,2022-06-14,10:50,VISTORIA EM CASA QUE APRESENTA RACHADURAS DEPOIS DE SER ALAGADA NO SÁBADO 28/05/2022.,NOVA DESCOBERTA,NOVA DESCOBERTA,"AV. VEREADOR OTACÍLIO DE AZEVEDO, N 3722 A",Alagamentos,-1,-7.993837300000001,-34.9273922,google maps api,LVd4
8066999222,2022-06-13,14:59,SR SOLICITA A RETIRADA DE PÉS DE COCOS QUE ESTAO OFERECENDO RISCO PARA AS RESIDENCIAS,NOVA DESCOBERTA,ALTO DO RESERVATORIO,RUA ALTO DO RESERVATORIO N575,Arvores em Risco,-1,-7.997706000000001,-34.9336468,google maps api,LVd4
8071266022,2022-06-22,16:34,"USUARIA SOLICITA COLOCAÇÃO DE LONA , E PRECISA DE CAPINAÇÃO NO LOCAL.",NOVA DESCOBERTA,NOVA DESCOBERTA,CORREGO DO INACIO,Alagamentos,-1,-7.9971886,-34.9303789,google maps api,LVd4
8058433322,2022-05-31,10:28,"USUÁRIA OSOLICITA VISTORIA EM C[SUA CASA DEVIDO A TER ALAGADO E TER PERDIDO TUDO, CHEGANDO O NÍVEL DA ÁGUA A 2 METROS.",NOVA DESCOBERTA,NOVA DESCOBERTA,"RUA ENGENHEIRO AVIDO, N41",Alagamentos,-1,-7.9999798,-34.9212903,google maps api,LVd4
8054399522,2022-05-26,13:32,Usuário solicita vistoria uma familia recebe o beneficio do auxilio moradia mais ainda não saiu do imovél. a casa está praticamente caindo.,NOVA DESCOBERTA,ALTO DO REFUGIO,SUBIDA DA GAMELEIRA N226,Invasao de Terreno de Auxilio Moradia,-1,-7.999621599999999,-34.9281835,google maps api,LVd4
8039167121,2021-05-04,08:26,"SOLICITA VISTORIA EM CENTRO DE RECICLAGEM ONDE HOUVE INCÊNDIO, CORPO DE BOMBEIROS JÁ FOI ATÉ O LOCAL.",MUSTARDINHA,MUSTARDINHA,"RUA JOSE BEZERRA CAVALCANTI, 329",Incendios,-1,-8.072148499999999,-34.9220262,google maps api,HP
8135572919,2019-11-13,17:10,SRA INFORMA QUE ESTAO CONSTRUINDO UM PRIMEIRO ANDAR NUM TERRENO QUE FOI CONDENADO PELA PREFEITURA,VASCO DA GAMA,VASCO DA GAMA,RUA PITARANA N272,Invasao de Terreno de Auxilio Moradia,-1,-8.0939648,-34.9216804,google maps api,HP
8080538922,2022-07-17,08:25,"Usuário denúncia morador, que mesmo recebendo auxílio moradia, voltou a morar no local que resultou no valor do beneficio.",NOVA DESCOBERTA,NOVA DESCOBERTA,"Rua monsenhor teobaldo rocha, n117",Invasao de Terreno de Auxilio Moradia,-1,-8.0080861,-34.9233136,google maps api,A2
8012224114,2014-07-30,11:35,"DEMANDANTE INFORMA QUE ACONTECEU UM INCÊNDIO, ONDE DOIS IMOVEIS ESTÃO COM RISCO. PEDE AVALIAÇÃO",MUSTARDINHA,MUSTARDINHA,"RUA MAJOR MARIO PORTELA, 156",Incendios,-1,-8.070311799999999,-34.9168571,google maps api,HP
8077494422,2022-07-07,16:12,"VISTORIA USUARIA SOLICITA VISTORIA NO LOCAL DA RESIDENCIA , POIS A CASA ESTA EM ÁREA DE RISCO POIS A CASA É ENTRE DUAS BARREIRAS A LOCALIZAÇÃO É DE RISCO.",NOVA DESCOBERTA,NOVA DESCOBERTA,RUA PETI CAVALCANTE 35,Alagamentos,-1,-8.0194486,-34.9265968,google maps api,A2
8076296422,2022-07-05,15:40,"colocação de lonas plásticasusuária informa que ja solicitou a colocação de lona , a equipe esteve no local colocou a lona , mais o vento já rasgou , precisa colocar outra e tem riscos de árvores no local.",NOVA DESCOBERTA,ALTO JD. PROGRESSO,alto doutor caete nova descoberta,Arvores em Risco,-1,-8.0031357,-34.92947,google maps api,LVd4
8081730022,2022-07-20,14:07,"vistoria na residênciausuária informa que a casa dela o piso sedeu , a laje está em risco pois ela já ouviu até estralos  no local.",NOVA DESCOBERTA,NOVA DESCOBERTA,quarta travessa de chargas ferreira,Alagamentos,-1,-7.999621599999999,-34.9281835,google maps api,LVd4
8064235522,2022-06-08,10:13,"USUARIO INFORMA ARVORE EM RISCO DE CAIR SOBRE SUA CASA SOLICITA ERRADICAR, PRECISA DE LONA PLASTICA, MEDIO PORTE. SOLICITA VISTORIA.",NOVA DESCOBERTA,CGO. DA AREIA,"RUA NOVA REZENDE, 40",Arvores em Risco,-1,-8.000698,-34.923952,google maps api,LVd4
8065386722,2022-06-09,15:23,IMOVEIS ALAGADOS DEVIDO A ENCHENTE DAS ULTIMAS CHUVAS.,NOVA DESCOBERTA,NOVA DESCOBERTA,RUA OTACÍLIO DE AZEVEDO 14,Imoveis Alagados,-1,-7.998552,-34.9244982,google maps api,LVd4
8066092722,2022-06-10,14:54,SOLICITA VISTORIA EM UMA ARVORE QUE ESTÁ COM RISCO DE DESABAR A QUALQUER MOMENTO INCLUSIVE UM GRANDE GALHO CAIU EM SUA CASA.,NOVA DESCOBERTA,CGO. DO INACIO,RUA CORREGO DO INACIO 64A,Arvores em Risco,-1,-7.9979858,-34.93002269999999,google maps api,LVd4
8065329322,2022-06-09,14:51,"A CASA DA USUÁRIA ALAGOU, PERDEU MUITA COISA E SOLICITA UMA VISTORIA.99146637 ESPOSO",NOVA DESCOBERTA,NOVA DESCOBERTA,RUA SITIO DOS NOBRES,Alagamentos,-1,-7.997447,-34.9243806,google maps api,LVd4
8065895922,2022-06-10,11:13,USUARIA INFORMA CASA ALAGADA. SOLICITA VISTORIA.,NOVA DESCOBERTA,NOVA DESCOBERTA,RUA SITIO DOS NOBRES 538,Alagamentos,-1,-7.997447,-34.9243806,google maps api,LVd4
8064441422,2022-06-08,12:40,A MESMA PEDE UMA VISTORIA POIS AS ARVORES ESTAO ESTALANDO E PODE CAIR A CAIR MOMENTO,NOVA DESCOBERTA,ALTO DO RESERVATORIO,RUA ALTO DO RESERVATORIO N.16,Arvores em Risco,-1,-7.997706000000001,-34.9336468,google maps api,LVd4
8065160922,2022-06-09,12:59,USUÁRIO INFORMA QUE NO DIA 04/06 A CASA DELE FOI IMUNDADA E TEVE PERDA TOTAL E GOSTARIA DE UMA VISTORIA NA RESIDENCIA! EO QUE PODERIA SER FEITO PELA DEFESA CIVIL!,NOVA DESCOBERTA,CGO. DA AREIA,RUA SITIO DOS NOBRES N.245,Imoveis Alagados,-1,-7.9972701,-34.9240785,google maps api,LVd4
8061711022,2022-06-03,20:59,"USUÁRIA SOLICITA VISTORIA, PRA VERIFICAR UM COQUEIRO QUE FICA LOCALIZADO EM UMA ÁREA QUE DESLIZA DIARIAMENTE, SEGUNDO ELA ESSA ARVORE FRUTÍFERA É BEM GRANDE, E PODE CAIR A QUALQUER MOMENTO. É NECESSÁRIO CAPINAÇÃO E COLOCAÇÃO DE LONAS PLASTICAS",NOVA DESCOBERTA,CGO. DO JOAQUIM,SUBIDA DO JOQUIM N 98,Arvores em Risco,-1,-7.998383100000001,-34.9325734,google maps api,LVd4
8062579922,2022-06-06,13:28,USUÁRIA INFORMA QUE O VIZINHO DA PARTE DE CIMA TEM UMA ARVORE DE TAMANHO DE UM POSTE COM RISCO DE QUEDA!,NOVA DESCOBERTA,CGO. DA JOSELIA,PRIMEIRA SUBIDA DO COMISSARIO N.04,Arvores em Risco,-1,-7.9992886,-34.9285636,google maps api,LVd4
8018591415,2015-06-29,09:45,USUÁRIO SOLICITA ERRADICAÇÃO DE ARVORE QUE ESTA COM RISCO DE CAIR POR CIMA DAS RESIDENCIAS. URGENTE.,MONTEIRO,MONTEIRO,"RUA DAS LEVADAS, N°62.",Arvores em Risco,-1,-8.0258973,-34.9291749,google maps api,A2
8009730822,2022-02-01,10:44,SOLICITA VISTORIA PÉ DE AROEIRA COM RISCO DE CAIR EM CIMA DA CASA DA MORADORA,MORRO DA CONCEICAO,MORRO DA CONCEICAO,RUA ITABAIANA 56,Arvores em Risco,-1,-8.0178046,-34.9146621,google maps api,URBANO
8059728020,2020-08-20,11:39,USUÁRIO SOLICITA EQUIPE PARA FAZER VISTORIA EM IMÓVEL PARCIALMENTE DESTRUÍDO PELA EQUIPE DA DEFESA CIVIL POR SER CONDENADO. INFORMA QUE EXISTE UMA MULHER OCUPANDO O LOCAL SEM PERMISSÃO.,MORRO DA CONCEICAO,MORRO DA CONCEICAO,"RUA CGO DO BARTOLOMEU, 391",Invasao de Terreno de Auxilio Moradia,-1,-8.0196838,-34.9142478,google maps api,URBANO
8073433420,2020-10-21,14:15,USUÁRIA SOLICITA VISTORIA EM COQUEIRO QUE AMEAÇA CAIR SOBRE A CASA.,MORRO DA CONCEICAO,MORRO DA CONCEICAO,"RUA SANTA GERTRUDES, 150",Arvores em Risco,-1,-8.0195394,-34.9118683,google maps api,URBANO
8038244420,2020-04-16,08:56,usuária solicita vistoria na casa em que entrou água da chuva.,MORRO DA CONCEICAO,MORRO DA CONCEICAO,"itabaiana, 108",Alagamentos,-1,-8.0174522,-34.9150151,google maps api,URBANO
8092489819,2019-07-25,21:44,"arvore em risco, o mesmo informa que a raiz esta solta, e ela pode acabar tombando em sua casa",MORRO DA CONCEICAO,MORRO DA CONCEICAO,"corrego mae luzia, 15",Arvores em Risco,-1,-8.0086294,-34.9032075,google maps api,URBANO
8036948019,2019-04-01,11:21,"SRA. SOLICITA A VISTORIA EM UM PÉ DE BABANANEIRA INFORMA QUE E ENORME E ESTA PENDENDO PRA CIMA DO TELHADO DA CASA, INFORMA QUE QUANDO CHOVE ENTRA MUITA AGUA NA RESIDENCIA.",MORRO DA CONCEICAO,MORRO DA CONCEICAO,RUA LUCELIA N 131,Arvores em Risco,-1,-8.018833299999999,-34.9133007,google maps api,URBANO
8082248018,2018-06-28,08:56,USUÁRIA INFORMA QUE O TERRENO INTERDITADO PELA DEFESA CIVIL POR QUE ERA DE TAIPA. E AGORA UM VIZINHO FEZ CONSTRUÇÃO E PEGOU A METADE DO TERRENO.,MORRO DA CONCEICAO,MORRO DA CONCEICAO,RUA LADEIRA DO BARTOLOMEU N 51,Invasao de Terreno de Auxilio Moradia,-1,-8.0193154,-34.9111813,google maps api,URBANO
8061095316,2016-09-30,15:55,USUARIA INFORMOU QUE TEM UM PE DE COCO PROX. AO MURO DE ARRIMO DE VIZINHO BALANÇANDO MUITO E COM RISCOS DE QUEDA POIS OS COCOS JA VIERAM A CAIR EM CIMA DE SUA RESIDENCIA CAUSANDO TRANSTORNOS. A MESMA PEDE URGENCIA.,MORRO DA CONCEICAO,MORRO DA CONCEICAO,RUA ITABAIANA N 56,Arvores em Risco,-1,-8.0178046,-34.9146621,google maps api,URBANO
8055023416,2016-09-02,11:47,USUARIA INF QUE INVADIRAM O TERRENO. A MESMA INF QUE ESTA CAUSANDO TRANSTORNO,MORRO DA CONCEICAO,MORRO DA CONCEICAO,"RUA   ERVALIA, 1012",Invasao de Terreno de Auxilio Moradia,-1,-8.0168879,-34.916108,google maps api,URBANO
8030934515,2015-10-08,09:51,usuaria informa que esta tendo uma invasão no terreno que foi interditado pela defesa civil do recife,MORRO DA CONCEICAO,MORRO DA CONCEICAO,2  Travessa Santa Gertrudes  n 71,Invasao de Terreno de Auxilio Moradia,-1,-8.0199462,-34.9125027,google maps api,URBANO
8019068514,2014-10-30,10:33,"CIDADÃ SOLICITA VISTORIA EM IMOVEL QUE FOI INTERDITADO PELA SEDEC, A MESMA DESEJA SABER SE EXISTE A POSSIBILIDADE DE RETORNAR A MORAR NO LOCAL, POIS O IMOVEL FOI INTERDITADO FAZEM 14 ANOS.",MORRO DA CONCEICAO,MORRO DA CONCEICAO,"RUA OLIVENÇA, Nº 580",Invasao de Terreno de Auxilio Moradia,-1,-8.0185234,-34.9156748,google maps api,URBANO
8047904118,2018-04-13,12:34,USUÁRIA SOLICITA VISTORIA EM ARVORE QUE EM FRENTE A CASA DELA E A MESMA AFIRMA QUE A ARVORE ESTA TOMBANDO PARA O LADO DA CASA DA SOLICITANTE .,MUSTARDINHA,MUSTARDINHA,RUA JOSÉ MOREIRA REIS N 525,Arvores em Risco,-1,-8.0683201,-34.919509,google maps api,HP
8047906418,2018-04-13,12:34,USUÁRIA SOLICITA VISTORIA EM ARVORE QUE EM FRENTE A CASA DELA E A MESMA AFIRMA QUE A ARVORE ESTA TOMBANDO PARA O LADO DA CASA DA SOLICITANTE .,MUSTARDINHA,MUSTARDINHA,RUA JOSÉ MOREIRA REIS N 525,Arvores em Risco,-1,-8.0683201,-34.919509,google maps api,HP
8023086920,2020-02-18,11:39,Usuário informa que TEM O PE DE COQUEIRO QUE ESTA COM RISCO DE CAIR A QUALQUER MOMENTO . PEDE URGÊNCIA DE UMA VISTORIA NO LOCAL,MUSTARDINHA,MUSTARDINHA,rua moreira reis n 661,Arvores em Risco,-1,-8.0679076,-34.9207074,google maps api,HP
8078851920,2020-11-10,08:08,"USUÁRIO SOLICITA VISTORIA, POIS INFORMA QUE TEM UM PÉ DE COCO NO QUINTAL DO VIZINHO QUE ESTÁ COM RISCO DE CAIR EM CIMA DA SUA CASA. INFORMA TAMBÉM QUE A SUA CASA ESTÁ COM RACHADURAS E CUPIM.",MUSTARDINHA,MUSTARDINHA,"RUA MANOEL AZEVEDO DE ANDRADE, 74",Arvores em Risco,-1,-8.071531,-34.915681,google maps api,HP
8048269818,2018-04-15,11:57,"USUÁRIA SOLICITA VISTORIA EM UMA ARVORE NO QUINTAL DE SUA VIZINHA,QUE ESTÁ  OFERECENDO RISCO DE CAIR E ATINGIR SUA RESIDENCIA, ELA DISSE QUE OS GALHOS ESTÃO DESABANDO E COM CUPINS.",MADALENA,MADALENA,"RUA MANOEL BEZERRA , N 249",Arvores em Risco,-1,-8.054966499999999,-34.9112046,google maps api,URBANO
8086669018,2018-07-10,10:05,"DESEJA VISTORIA EM IMÓVEL POIS CAIXA D'ÁGUA DE MAIS DE DOIS MIL LITROS DANIFICOU TODA CASA E TEM OUTRA CAIXA COM RISCO DE QUEDA .OBSERVAÇÃO DANIFICOU TODO TELHADO E MOVEIS ,ATINGIU A MORADORAS POREM NÃO HOUVE NECESSIDADE DE IR AO HOSPITAL E ESTÃO EM CASA DE AMIGOS .OCORRIDO POR VOLTA  DAS 00:30 MADRUGADA DE HOJE!",MADALENA,MADALENA,RUA DAS MELINDROSAS 70,Imoveis Alagados,-1,-8.0504135,-34.9124661,google maps api,A2
8003888416,2016-01-30,16:18,USUÁRIA SOLICITA VOSTORIA EM ÁRVORE COM RISCO DE CAIR E CAUSAR ACIDENTE. ÁRVORE DE GRANDE PORTE.,MADALENA,MADALENA,RUA EUDEIA   N 58,Arvores em Risco,-1,-8.0025057,-34.9058521,google maps api,LVd4
8017801515,2015-06-21,15:53,"MORADORA INFORMA QUE HOUVE UM INCENDIO EM APARTAMENTO DO 3º ANDAR, DE UM PREDIO DE 16º ANDARES, NO DIA DE ONTEM. A EQUIPE DO CORPO DE BOMBEIROS CONTROLOU AS CHAMAS E LIBEROU O IMOVEL PARA OCUPAÇÃO. POREM NECESSITA DE UMA VISTORIA TECNICA DA SEDEC.",MADALENA,MADALENA,"RUA PADRE LANDIM, Nº 302",Incendios,-1,-8.048773599999999,-34.9126263,google maps api,A2
8032417815,2015-10-25,16:57,"o soldado da equipe de bombeiros  informa que a clinica pegou fogo.favor verificar com urgencia, o mesmo pede o reforço do sedec.",MADALENA,MADALENA,av visconde de albuquerque,Incendios,-1,-8.0535443,-34.9068114,google maps api,URBANO
8003864816,2016-01-30,13:40,USUÁRIO SOLICITA A VISTORIA EM ARVORE,MADALENA,MADALENA,"RUA BELARMINO CARNEIRO N, 252",Arvores em Risco,-1,-8.0498113,-34.9094531,google maps api,A2
8087584619,2019-07-17,12:46,SR SOLICITA A RETIRADA DE UM PÉ DE CAJA QUE ESTA PROXIMO A  UMA ÁREA DE RISCO,MANGABEIRA,MANGABEIRA,RUA LADEIRA DO GIO N08,Arvores em Risco,-1,-8.0241206,-34.9031038,google maps api,URBANO
8018754015,2015-06-29,12:57,"USUÁRIA INFORMA QUE A ÁGUA ESTÁ NA BASE DO PREDIO PODENDO CAUSAR PROBLEMAS NA ESTRUTURA, PEDE URGÊNCIA NA VISTORIA.",MANGABEIRA,MANGABEIRA,AV PROFESSOR JOSE DOS ANJOS,Imoveis Alagados,-1,-8.026319,-34.9031726,google maps api,URBANO
8021663414,2014-12-11,11:59,"VISTORIA COM URGÊNCIA HOUVE INCÊNDIO COM VÍTIMAS (01 MULHER E 01 CRIANÇA, JÁ SOCORRIDOS PARA UPA).",MANGABEIRA,MANGABEIRA,RUA LAGE DO UNA N. 61,Incendios,-1,-8.0242278,-34.903262,google maps api,URBANO
8009025222,2022-01-28,22:13,"USUÁRIA ENTRA M CONTATO E INFORMA QUE HOUVE A QUEDA DE UMA ÁRVORE DE UMA CASA PARA A OUTRA, ELA SOLICITA UMA VISTORIA NO LOCAL, INFORMA QUE NÃO TEM VÍTIMAS.",MANGUEIRA,MANGUEIRA,BONITO N 334,Arvores em Risco,-1,-8.0781054,-34.9217976,google maps api,HP
8026200322,2022-03-17,16:08,"USUÁRIO INFORMA QUE TEM UMA ÁRVORE NA RESIDÊNCIA, QUE ESTÁ COM IMINÊNCIA DE CAIR SOBRE O IMÓVEL. SOLICITA VISTORIA COM URGÊNCIA.",MANGUEIRA,MANGUEIRA,"RUA VEREADOR FRANCISCO DE PAULA SANTANA, N 118",Arvores em Risco,-1,-8.0798655,-34.9196274,google maps api,HP
8065695022,2022-06-10,08:20,"USUARIA INFORMA ALAGAMENTO, CASA COM RACHADURAS. SOLICITA VISTORIA.",MANGUEIRA,MANGUEIRA,"RUA BOM JARDIM, 226",Alagamentos,-1,-8.0794155,-34.9226093,google maps api,HP
8087152919,2019-07-14,08:57,"usuária informa que uma arvore caiu em cima de sua residencia, solicita de uma vistoria na casa se houve algum rachaduras",MANGUEIRA,MANGUEIRA,RUA   BERNADETE XAVIER GOMES n 60,Arvores em Risco,-1,-8.0770243,-34.9191535,google maps api,HP
8055877822,2022-05-28,10:51,"USUARIA INFORMA CASAS ALAGADAS, MORADORES FORAM PRA ESCOLA SILVA JARDIM, SE ABRIGAR, O DIRETOR DISSE QUE PRECISA AUTORIZAÇÃO DA DEFESA CIVIL.",MONTEIRO,MONTEIRO,"TRAVESSA DO GENIPAPO, SN",Alagamentos,-1,-8.025565,-34.9299881,google maps api,A2
8062059522,2022-06-05,10:24,"USUÁRIA INFORMA QUE SUA CASA FOI LAGADA ATÉ O TETO E APRESENTA RACHADUAS, SOLICITA VISTORIA.",MONTEIRO,MONTEIRO,"RUA 19 DE ABRIL, N 17",Alagamentos,-1,-8.0278235,-34.9295319,google maps api,AGUA
8004294215,2015-02-19,10:36,"USUÁRIA SOLICITA VISTORIA EM UMA ARVORE DE GRANDE PORTE, INFORMA QUE ARVORE ESTA DENTRO DO QUINTAL DA VIZINHA E COM RISCO DE CAIR POR CIMA DA RESIDENCIA DA MESMA PEDE  URGÊNCIA.",MANGUEIRA,MANGUEIRA,"RUA BONITO N,334",Arvores em Risco,-1,-8.0781054,-34.9217976,google maps api,HP
8002015517,2017-01-09,17:45,"USUÁRIA SOLICITA VISTORIA EM TERRENO INTERDITADO PELA DEFESA CIVIL, POIS ESTA SENDO INVADIDO PARA CONSTRUÇÕES DE MORADIAS.",MACAXEIRA,BURITY,RUA CARLOS LAMARCA SN,Invasao de Terreno de Auxilio Moradia,-1,-8.0157501,-34.9277378,google maps api,A2
8036884816,2016-06-17,10:35,USUARIA PEDE URGENCIA POIS A ARVORE ESTA PRESTES A CAIR,MACAXEIRA,BURITY,"RUA NICOLAU JERONIMO DE BARROS, N 96",Arvores em Risco,-1,-8.0078379,-34.9286192,google maps api,LVd4
8024609716,2016-05-11,12:19,USUARIA INFORMA QUE PÉ DE MANGA NA BARREIARA ESTA OFERENCENDO RISCO DE CAIR EM SUA CASA,MACAXEIRA,BURITY,RUA NICOLAU JERONIMO BARROS 95,Arvores em Risco,-1,-8.0078304,-34.9287156,google maps api,LVd4
8000841716,2016-01-09,17:15,"USUARIO RELATA QUE O TERRENO CONDENADO PELO SEDEC TERCEIROS INVADIRAM E ESTÃO REALIZANDO CONSTRUÇÃO, VERIFICAR EM URGENCIA.",MACAXEIRA,MACAXEIRA,"TRV ESTER, N  165",Invasao de Terreno de Auxilio Moradia,-1,-8.007482,-34.9336429,google maps api,LVd4
8030861815,2015-10-07,13:56,"usuario denuncia invasao no terreno da urb,favor verificar.",MACAXEIRA,MACAXEIRA,massarantuba n 40 a,Invasao de Terreno de Auxilio Moradia,-1,-8.0195954,-34.9285292,google maps api,A2
8020008214,2014-11-13,15:13,DENUNCIANTE INFORMA QUE CONSTRUIRAM BARRACOS EM UM TERRENO QUE FOI CONDENADO PELA SEDEC. PEDE VISTORIA NO LOCAL COM URGENCIA.,MACAXEIRA,MACAXEIRA,"RUA JORNALISTA SANEIVA DE VASCONCELOS, Nº 313",Invasao de Terreno de Auxilio Moradia,-1,-8.0153771,-34.9274081,google maps api,A2
8017324414,2014-10-07,16:15,"USUÁRIO INFORMA QUE UM MORADOR INVADIU TERRENO DA PREFEITURA (CONDENADO) REFERENTE A RISCO, E ESTE MORADOR SE CERCO ESTE TERREANDO SE DIZENDO PROPRIETÁRIO DO MESMO FAVOR VERIFICAR.",MACAXEIRA,BURITY,TRAV ESTER N°126,Invasao de Terreno de Auxilio Moradia,-1,-8.0086578,-34.9333649,google maps api,A2
8019754614,2014-11-08,13:55,"AS PESSOAS INVADIRAM UM TERRENO QUE ESTA CONDENADO PELA CODECIR,PEDE URGENCIA POIS A INVASAO ESTA NO COMEÇO.",MACAXEIRA,MACAXEIRA,RUA JORNALISTA SANEIVA DE VASCONCELOS Nº313,Invasao de Terreno de Auxilio Moradia,-1,-8.0153771,-34.9274081,google maps api,A2
8019514514,2014-11-05,14:34,"USUÁRIO INFORMA QUEM TEM UM TERRENO CONDENADO,MAIS QUE ALGUNS MORADORES INVADIRAM O LOCAL E ESTÃO CONSTRUINDO BARRACOS NO LOCAL.O MESMO PEDE URGÊNCIA NA VISTORIA.",MACAXEIRA,MACAXEIRA,RUA JORNALISTA FANEIVA DE VASCONCELOS N313,Invasao de Terreno de Auxilio Moradia,-1,-8.0146283,-34.9274554,google maps api,A2
8071662222,2022-06-24,01:03,USUARIO INFORMAQUE A ARVORE CAIU NO MURO DO CONDOMINIO SANTA MAFALDA. E INFORMA QUE TEM UMA OUTRA ARVORE OFERENCEDO RISCO DE QUEDA. O MESMO PEDE UMA EQUIPE NO LOCAL,MADALENA,MADALENA,RUA BENFICA  N 604,Arvores em Risco,-1,-8.0578592,-34.9045289,google maps api,URBANO
8045108321,2021-05-18,10:41,"USUÁRIO SOLICITA VISTORIA, POIS A ÁRVORE DA VIZINHA ESTÁ INCLINADO PARA SUA CASA. INFORMA QUE JÁ CAIU GALHO QUE PODERIA TER ATINGIDO A SUA CASA. A ÁRVORE ESTÁ COM CUPIM.",MADALENA,MADALENA,"RUA MANOEL BEZERRA, 249",Arvores em Risco,-1,-8.054966499999999,-34.9112046,google maps api,URBANO
8054834521,2021-06-18,22:35,"arvore esta inclinada, e jardineiro declarou sugeriu erradicar a arvore por inclinacao ser anormal e poderia causar prejuizo patrimonial e a moradores",MADALENA,MADALENA,"rua altinho, 62",Arvores em Risco,-1,-8.0558557,-34.90561599999999,google maps api,URBANO
8042666319,2019-04-12,09:00,"SRA. SOLICITA A VISTORIA COM URGÊNCIA EM UM PREDIO DE QUATRO ANDARES POIS ESTAO FAZENDO UMA CONSTRUÇÃO QUEBRANDO TUDO EM CIMA DO SEU APARTAMENTO , E AGORA ESTA TUDO ALAGADO NA SUA CASA E NA DA VIZINHA",MADALENA,MADALENA,RUA ERNANDES BRAGA N 413,Imoveis Alagados,-1,-8.0499914,-34.9106659,google maps api,A2
8122563619,2019-10-12,05:54,SARGENTO ANDRADE PROCOLO bB1304252 INFORMA INCÊNCIO EM UM DOS APARTAMNENTOS E SOLICITA PRESENÇA DA DEFESA CIVIL AO LOCAL. SEM VITIMAS.,MADALENA,MADALENA,AV BEIRA RIO,Incendios,-1,-8.0513946,-34.9038626,google maps api,URBANO
8082961017,2017-09-12,15:52,USUÁRIA INFORMA QUE EXISTE UM INDIVIDUO QUE ESTA INVADINDO UM TERRENO DA PREFEITURA. O MESMO CORTOU UMA ÁRVORE DE (GP) QUE ESSA ÁRVORE CAIU POR CIMA DA FIAÇÃO. USUÁRIO ESTA SE APROPRIANDO DESSE TERRENO E A MESMA INFORMA QUE ESSE INDIVIDUO ESTÁ REALIZANDO SERVIÇOS NESSE TERRENO. FAVOR VERIFICAR COM URGÊNCIA.,MADALENA,MADALENA,"RUA PIO IX, N 530",Invasao de Terreno de Auxilio Moradia,-1,-8.0436309,-34.9115661,google maps api,AGUA
8086720717,2017-09-22,14:30,SOMBREIRO ESTA RACHADO NO MEIO COM METADE TODA EM CIMA DA CASA DO USUÁRIO E A OUTRA PARA A RUA. SOLICITA EMERGÊNCIA,MADALENA,MADALENA,RUA DR ARTHU GONÇALVES N  98,Arvores em Risco,-1,-8.0521403,-34.9077287,google maps api,URBANO
8053638821,2021-06-15,16:05,SOLICITA VISTORIA EM ÁRVORE QUE ESTÁ COM RISCO DE CAIR.,MACAXEIRA,MACAXEIRA,RUA SONIA MARIA LOPES N 364,Arvores em Risco,-1,-8.0098991,-34.9304697,google maps api,A2
